Заголовок,ссылка,Цена,Адрес,Дата,comment
"2-комнатная квартира, 77.34 м²Все заметкиУдалить",https://krisha.kz//a/show/663226164,от 41 474 761〒,"Бостандыкский р-н, Розыбакиева 320",Алматы29 нояб.,"жил. комплекс 4YOU, 17 этажей, 2020 г.п., жил. площадь 41.69 кв.м., кухня 16.17 кв.м., потолки 2.7м., санузел совмещенный, Квартал ярких идей! Жилой Квартал 4YOU - В нем прекрасно всё: начиная от локации, заканчивая детально продуманной планировкой квар…"
"2-комнатная квартира, 74.79 м²Все заметкиУдалить",https://krisha.kz//a/show/663226163,от 43 273 494〒,"Бостандыкский р-н, Розыбакиева 320",Алматы29 нояб.,"жил. комплекс 4YOU, 17 этажей, 2020 г.п., жил. площадь 40.02 кв.м., кухня 12.69 кв.м., потолки 2.7м., санузел совмещенный, Квартал ярких идей! Жилой Квартал 4YOU - В нем прекрасно всё: начиная от локации, заканчивая детально продуманной планировкой квар…"
"2-комнатная квартира, 76.42 м²Все заметкиУдалить",https://krisha.kz//a/show/50937383,от 42 306 112〒,"Бостандыкский р-н, Гагарина 194ИпотекаИпотекаКвартиры, которые можноприобрести в ипотекуот банков и по гос.программам",Алматы29 нояб.,"жил. комплекс Дом на Гагарина, 13 этажей, 2019 г.п., потолки 2.7м., санузел совмещенный, Преимущества: ✅Свободная планировка✅Сейсмостойкость 9 баллов✅Подземный и гостевой паркинг✅Кладовые места✅Система противопо…"
"2-комнатная квартира, 79 м², 6/6 этажВсе заметкиУдалить",https://krisha.kz//a/show/57298033,61 000 000〒,"Бостандыкский р-н, мкр Ерменсай, 6-переулок 25/1",Алматы29 нояб.,"жил. комплекс Remizovka, монолитный дом, 2019 г.п., состояние: евроремонт, потолки 3.2м., полностью меблирована, ЖК Ремизовка, первая очередь, лучший этаж, застройщик Базис-А, дорогой ремонт и мебель, заменены все стеновые перегородки на немецкий профиль, утеплены стены, теплый пол, паркетная…"
"2-комнатная квартира, 78.93 м²Все заметкиУдалить",https://krisha.kz//a/show/663226167,от 43 956 117〒,"Бостандыкский р-н, Розыбакиева 320",Алматы29 нояб.,"жил. комплекс 4YOU, 17 этажей, 2020 г.п., жил. площадь 38.85 кв.м., кухня 14.91 кв.м., потолки 2.7м., санузел 2 с/у и более, Квартал ярких идей! Жилой Квартал 4YOU - В нем прекрасно всё: начиная от локации, заканчивая детально продуманной планировкой квар…"
"2-комнатная квартира, 85.31 м²Все заметкиУдалить",https://krisha.kz//a/show/663226168,от 45 069 273〒,"Бостандыкский р-н, Розыбакиева 320",Алматы29 нояб.,"жил. комплекс 4YOU, 17 этажей, 2020 г.п., жил. площадь 43.17 кв.м., кухня 15.21 кв.м., потолки 2.7м., санузел 2 с/у и более, Квартал ярких идей! Жилой Квартал 4YOU - В нем прекрасно всё: начиная от локации, заканчивая детально продуманной планировкой квар…"
"2-комнатная квартира, 45 м², 2/4 этажВсе заметкиУдалить",https://krisha.kz//a/show/663540603,21 500 000〒,"Бостандыкский р-н, Жарокова — Жандосова",Алматы29 нояб.,"кирпичный дом, 1964 г.п., состояние: евроремонт, санузел совмещенный, телефон: отдельный, интернет ADSL, частично меблирована, Продаётся квартира в центре города в исключительном состоянии по самой выгодной цене! Пластиковые окна, кухня-студия, встроенная кухня, новая сантехника, счётчики, тихий…"
"2-комнатная квартира, 72 м², 11/12 этажВсе заметкиУдалить",https://krisha.kz//a/show/663616458,35 000 000〒,"Бостандыкский р-н, Егизбаева Косая (Линия 21-я) — Сатпаева",Алматы29 нояб.,"жил. комплекс Асыл Тау, монолитный дом, 2016 г.п., состояние: евроремонт, санузел 2 с/у и более, Продаётся 2-комнатная в ЖК Асыл Тау. Квартира улучшенной планировки в самом ликвидном районе города Алматы. Квартира в отличном состоянии. Не требует никаких вложений! Развитая инфраструктура, не углова…"
"2-комнатная квартира, 58.3 м², 5/6 этажВсе заметкиУдалить",https://krisha.kz//a/show/662768941,26 500 000〒,"Бостандыкский р-н, улица Тимирязева 50/1 — Жарокова",Алматы29 нояб.,"монолитный дом, 2016 г.п., состояние: евроремонт, потолки 3м., санузел совмещенный, телефон: отдельный, интернет оптика, частично меблирована, Преимущества: • Вид на горы • Развитая инфраструктура • Имеется лифт. КОМЕРЧЕСКОЕ ЗДАНИЕ, МОЖНО ПРОЖИВАТЬ ЛИБО ПОД ОФИС. Рядом с «Атакентом. Дом – из 6…"
"2-комнатная квартира, 61.2 м²Все заметкиУдалить",https://krisha.kz//a/show/50937296,от 33 880 320〒,"Бостандыкский р-н, Гагарина 194ИпотекаИпотекаКвартиры, которые можноприобрести в ипотекуот банков и по гос.программам",Алматы29 нояб.,"жил. комплекс Дом на Гагарина, 13 этажей, 2019 г.п., потолки 2.7м., санузел совмещенный, Преимущества: ✅Свободная планировка✅Сейсмостойкость 9 баллов✅Подземный и гостевой паркинг✅Кладовые места✅Система противопо…"
"2-комнатная квартира, 63.69 м²Все заметкиУдалить",https://krisha.kz//a/show/660813462,от 37 577 100〒,"Бостандыкский р-н, Гагарина 233",Алматы29 нояб.,"жил. комплекс Terra, 16 этажей, 2021 г.п., жил. площадь 38.88 кв.м., кухня 6.79 кв.м., потолки 2.85м., санузел совмещенный, Преимущества:✅Рассрочка от застройщика с первоначальным взносом от 30%, сроком на 11 месяцев.✅Подземный паркинг✅Экологически…"
"2-комнатная квартира, 66.43 м²Все заметкиУдалить",https://krisha.kz//a/show/660813463,от 39 858 000〒,"Бостандыкский р-н, Гагарина 233",Алматы29 нояб.,"жил. комплекс Terra, 16 этажей, 2021 г.п., жил. площадь 43.22 кв.м., кухня 8.09 кв.м., потолки 2.85м., санузел совмещенный, Преимущества:✅Рассрочка от застройщика с первоначальным взносом от 30%, сроком на 11 месяцев.✅Подземный паркинг✅Экологически…"
"2-комнатная квартира, 61.4 м²Все заметкиУдалить",https://krisha.kz//a/show/50937212,от 33 991 040〒,"Бостандыкский р-н, Гагарина 194ИпотекаИпотекаКвартиры, которые можноприобрести в ипотекуот банков и по гос.программам",Алматы29 нояб.,"жил. комплекс Дом на Гагарина, 13 этажей, 2019 г.п., потолки 2.7м., санузел совмещенный, Преимущества: ✅Свободная планировка✅Сейсмостойкость 9 баллов✅Подземный и гостевой паркинг✅Кладовые места✅Система противопо…"
"2-комнатная квартира, 71.71 м²Все заметкиУдалить",https://krisha.kz//a/show/663417147,от 33 345 150〒,"Бостандыкский р-н, Назарбаева 235 БИпотекаИпотекаКвартиры, которые можноприобрести в ипотекуот банков и по гос.программам",Алматы29 нояб.,"жил. комплекс Jer-Ana Residence, 19 этажей, 2022 г.п., потолки 3м., санузел 2 с/у и более, Возможно заключение Договора о долевом участии в жилищном строительстве на основании Гарантии Фонда гарантирования жилищного строительства №62…"
"2-комнатная квартира, 67.87 м²Все заметкиУдалить",https://krisha.kz//a/show/660813464,от 40 722 000〒,"Бостандыкский р-н, Гагарина 233",Алматы29 нояб.,"жил. комплекс Terra, 16 этажей, 2021 г.п., жил. площадь 38.13 кв.м., кухня 13.88 кв.м., потолки 2.85м., санузел 2 с/у и более, Преимущества:✅Рассрочка от застройщика с первоначальным взносом от 30%, сроком на 11 месяцев.✅Подземный паркинг✅Экологически чи…"
"2-комнатная квартира, 47 м², 3/4 этажВсе заметкиУдалить",https://krisha.kz//a/show/663574094,28 500 000〒,"Бостандыкский р-н, Навои 70 — Жандосова",Алматы29 нояб.,"жил. комплекс River House, 2020 г.п., состояние: евроремонт, Дом клубного типа 52 квартиры всего Потолки 3 м Рядом речка, терренкуры, на территории спотривные и детские площадки. Зона барбекю Рядом: ТРЦ МЕГА, школа 163, школа гимназия 199, школа Tamos Education, SBS med клиника, ясли /детские сады"
"2-комнатная квартира, 96.11 м²Все заметкиУдалить",https://krisha.kz//a/show/663417111,от 44 691 150〒,"Бостандыкский р-н, Назарбаева 235 БИпотекаИпотекаКвартиры, которые можноприобрести в ипотекуот банков и по гос.программам",Алматы29 нояб.,"жил. комплекс Jer-Ana Residence, 19 этажей, 2022 г.п., потолки 3м., санузел 2 с/у и более, Преимущества:✅Развитая инфраструктура✅Современная система пожарной безопасности✅Бесшумные скоростные лифты✅Современные детские игровые площадки✅Подзем…"
"2-комнатная квартира, 72 м², 2/3 этажВсе заметкиУдалить",https://krisha.kz//a/show/663604314,29 000 000〒,"Бостандыкский р-н, Жулдыз",Алматы29 нояб.,"жил. комплекс Famous Town, кирпичный дом, 2015 г.п., состояние: свободная планировка, санузел 2 с/у и более, пустая, Пластиковые окна, неугловая, комнаты изолированы, тихий двор, паркинг охрана Продается полноценная 2-х комнатная квартира в новом жк Famous town. Дом 2020года"
"2-комнатная квартира, 68.63 м², 3/8 этажВсе заметкиУдалить",https://krisha.kz//a/show/57867950,43 000 000〒,"Бостандыкский р-н, Розыбакиева — Ескараева",Алматы29 нояб.,"жил. комплекс 4YOU, 2020 г.п., Квартира # 7 в 1 очереди, сдача в эксплуатацию в декабре 2020 года! Комфорт класс Блок 1, в центре ЖК, одинаково удаленно от Розыбакиева и Гагарина Окна на юг"
"2-комнатная квартира, 71.7 м², 6/6 этажВсе заметкиУдалить",https://krisha.kz//a/show/663244190,43 020 000〒,"Бостандыкский р-н, Кашгарская 77",Алматы29 нояб.,"жил. комплекс BAIKONYR, монолитный дом, 2020 г.п., состояние: черновая отделка, потолки 3м., санузел совмещенный, пустая, Рады сообщить о новым Жилом комплексе BAIKONYR. Который состоит из 6-ти этажей с подземный паркингом и состоящих из 70 квартир. По расположению наш комплекс находиться по ули…"
"2-комнатная квартира, 73.3 м², 6/6 этажВсе заметкиУдалить",https://krisha.kz//a/show/663244526,43 980 000〒,"Бостандыкский р-н, Кашгарская 77",Алматы29 нояб.,"жил. комплекс BAIKONYR, монолитный дом, 2020 г.п., состояние: черновая отделка, потолки 3м., санузел 2 с/у и более, пустая, Рады сообщить о новым Жилом комплексе BAIKONYR. Который состоит из 6-ти этажей с подземный паркингом и состоящих из 70 квартир"
"2-комнатная квартира, 62.3 м², 6/6 этажВсе заметкиУдалить",https://krisha.kz//a/show/663290821,37 380 000〒,"Бостандыкский р-н, Кашгарская 77",Алматы29 нояб.,"жил. комплекс BAIKONYR, монолитный дом, 2020 г.п., состояние: черновая отделка, потолки 3м., санузел совмещенный, пустая, Рады сообщить о новым Жилом комплексе BAIKONYR. Который состоит из 6-ти этажей с подземный паркингом и состоящих из 70 квартир"
"2-комнатная квартира, 42 м², 2/4 этажВсе заметкиУдалить",https://krisha.kz//a/show/662811801,19 000 000〒,"Бостандыкский р-н, бульвар Бухар Жырау — Байзакова",Алматы29 нояб.,"кирпичный дом, 1961 г.п., состояние: евроремонт, жил. площадь 27 кв.м., кухня 8 кв.м., санузел совмещенный, частично меблирована, Дом кирпичный, расположен во дворе! Чистый и зелёный двор! Квартира в отличном состоянии, после капитального ремонта, светлая, теплая и уютная! Ипотека приветствуется…"
"2-комнатная квартира, 45 м², 4/6 этажВсе заметкиУдалить",https://krisha.kz//a/show/663569256,19 000 000〒,"Бостандыкский р-н, Кенесары Хана 83/2 — Аскарова",Алматы29 нояб.,"жил. комплекс Аскар Тау, монолитный дом, 2013 г.п., состояние: евроремонт, потолки 2.7м., санузел совмещенный, телефон: есть возможность подключения, интернет оптика, частично меблирована, Без комиссии! Квартира проверена юридически и проходит под ипотеку. Окна выходят на южную сторону, очень теп…"
"2-комнатная квартира, 114.2 м², 2/16 этажВсе заметкиУдалить",https://krisha.kz//a/show/663313945,70 000 000〒,"Бостандыкский р-н, Аль-Фараби 21 — Каратаева",Алматы29 нояб.,"жил. комплекс AFD Plaza, монолитный дом, 2014 г.п., состояние: евроремонт, потолки 3м., санузел 2 с/у и более, телефон: отдельный, интернет ADSL, полностью меблирована, Хорошее предложение по горячей цене! AFD Plaza - жилой комплекс расположен в самом сердце делового центра Алматы на пересечен…"
"2-комнатная квартира, 45 м², 2/4 этажВсе заметкиУдалить",https://krisha.kz//a/show/663601990,20 000 000〒,"Бостандыкский р-н, Аль-Фараби — Шашкина Зейна (Университетская)",Алматы29 нояб.,"панельный дом, 1972 г.п., состояние: хорошее, жил. площадь 30 кв.м., кухня 6 кв.м., санузел раздельный, полностью меблирована, Внимание, срочно! Рассматривают Ипотеку! Двухкомнатная квартира обычной планировки в одном из самых востребованных районов города! Квартира в исключительном состоянии!…"
"2-комнатная квартира, 40 м², 2/3 этажВсе заметкиУдалить",https://krisha.kz//a/show/663296453,16 500 000〒,"Бостандыкский р-н, Тимирязева — Розыбакиева",Алматы29 нояб.,"кирпичный дом, 1962 г.п., состояние: среднее, жил. площадь 27 кв.м., кухня 6 кв.м., потолки 2.5м., санузел совмещенный, частично меблирована, Продам 2 комнатную квартиру! Эта квартира в кирпичном доме. В шаговой доступности в любую точку города. Как известно кирпичный дом зимой сохраняет тепло…"
"2-комнатная квартира, 89.2 м², 6/16 этажВсе заметкиУдалить",https://krisha.kz//a/show/53475440,35 000 000〒,"Бостандыкский р-н, ул Радостовца — Сатпаева",Алматы29 нояб.,"жил. комплекс Бес Тулга, монолитный дом, 2016 г.п., состояние: черновая отделка, жил. площадь 78.7 кв.м., кухня 25 кв.м., потолки 3м., санузел 2 с/у и более, телефон: есть возможность подключения, интернет оптика"
"2-комнатная квартира, 76.64 м², 3/3 этажВсе заметкиУдалить",https://krisha.kz//a/show/661845076,34 679 600〒,"Бостандыкский р-н, мкр Ерменсай, Талапты 37",Алматы29 нояб.,"жил. комплекс Mountain Park, монолитный дом, 2021 г.п., состояние: хорошее, жил. площадь 45.8 кв.м., потолки 3м., санузел совмещенный, телефон: отдельный, интернет проводной, пустая, КВАРТИРА В ПРЕДГОРЬЯХ Жилой комплекс Mountain Park расположен в микрорайоне Ерменсай, в 3 минутах езды от Аль-Фара…"
"2-комнатная квартира, 45 м², 2/4 этажВсе заметкиУдалить",https://krisha.kz//a/show/663598160,20 000 000〒,"Бостандыкский р-н, Аль-Фараби — Шашкина Зейна (Университетская)",Алматы29 нояб.,"панельный дом, 1972 г.п., состояние: хорошее, жил. площадь 30 кв.м., кухня 6 кв.м., потолки 2.5м., санузел раздельный, телефон: отдельный, интернет ADSL, полностью меблирована, Внимание, срочно! Рассматривают Ипотеку! Двухкомнатная квартира обычной планировки в одном из самых востребованных райо…"
"2-комнатная квартира, 43 м², 1/4 этажВсе заметкиУдалить",https://krisha.kz//a/show/660513834,18 000 000〒,"Бостандыкский р-н, Радостовца — Тимирязева",Алматы29 нояб.,"панельный дом, 1961 г.п., состояние: евроремонт, жил. площадь 28.3 кв.м., кухня 5.5 кв.м., потолки 2.8м., санузел совмещенный, телефон: есть возможность подключения, интернет проводной, частично меблирована, Просьба посредников не беспокоить!"
"2-комнатная квартира, 44.5 м², 2/5 этажВсе заметкиУдалить",https://krisha.kz//a/show/663557709,23 500 000〒,"Бостандыкский р-н, мкр Орбита-1, Мкр Орбита-1 13",Алматы29 нояб.,"панельный дом, 1975 г.п., состояние: евроремонт, жил. площадь 27.9 кв.м., кухня 16.6 кв.м., потолки 2.5м., санузел совмещенный, телефон: отдельный, интернет ADSL, полностью меблирована, ✅ Продается 2-х комнатная квартира Бостандыкском районе Орбита 1 на 2 этаже с общей площадью 44.5 кв. м. ✅ Кварти…"
"2-комнатная квартира, 56 м², 7/12 этажВсе заметкиУдалить",https://krisha.kz//a/show/662468782,26 500 000〒,"Бостандыкский р-н, проспект Аль-Фараби — Ходжанова",Алматы29 нояб.,"монолитный дом, 1990 г.п., состояние: хорошее, потолки 2.7м., санузел раздельный, 215222 Продается 2 комнатная квартира. Монолитная конструкция обладает высокой сейсмостойкостью, так как высокая жёсткость каркаса сводит к минимуму склонность к трещинообразованию. В монолитных зданиях сущест…"
"2-комнатная квартира, 45 м², 2/4 этажВсе заметкиУдалить",https://krisha.kz//a/show/663589759,20 000 000〒,"Бостандыкский р-н, Аль-Фараби — Шашкина Зейна (Университетская)",Алматы29 нояб.,"панельный дом, 1972 г.п., состояние: хорошее, жил. площадь 30 кв.м., кухня 6 кв.м., санузел раздельный, полностью меблирована, Внимание, СРОЧНО! Рассматривают Ипотеку! Двухкомнатная квартира обычной планировки в одном из самых востребованных районов города! Квартира в исключительном состоянии!…"
"2-комнатная квартира, 99 м², 2/3 этажВсе заметкиУдалить",https://krisha.kz//a/show/660770017,73 863 563〒,"Бостандыкский р-н, мкр Ерменсай, Мкр. Ерменсай,",Алматы29 нояб.,"жил. комплекс Mountain Drive, 2018 г.п., санузел 2 с/у и более, телефон: нет, полностью меблирована"
