Заголовок,ссылка,Цена,Адрес,Дата,comment
"2-комнатная квартира, 52 м², 8/16 этажВсе заметкиУдалить",https://krisha.kz//a/show/663611344,27 000 000〒,"Бостандыкский р-н, Навои 208/6 — Торайгырова",Алматы29 нояб.,"жил. комплекс Шахристан, монолитный дом, 2015 г.п., состояние: евроремонт, санузел совмещенный, полностью меблирована"
"2-комнатная квартира, 55 м², 1/5 этажВсе заметкиУдалить",https://krisha.kz//a/show/661864240,24 500 000〒,"Бостандыкский р-н, 20-я линия 76 — Сатпаева",Алматы29 нояб.,"панельный дом, 1983 г.п., состояние: хорошее, санузел совмещенный, телефон: отдельный, интернет ADSL, частично меблирована, Срочная продажа! Весь пакет документов!"
"2-комнатная квартира, 54 м², 3/9 этажВсе заметкиУдалить",https://krisha.kz//a/show/661919425,25 500 000〒,"Бостандыкский р-н, Айманова 149 — Жандосова",Алматы29 нояб.,"панельный дом, 1986 г.п., Кухня 9, 2 лоджии, высота потолков 2-90, без ремонта, с/узел раздельный, север - юг, без перепланировок, изолированные, очень теплая светлая квартира, идеаальное расположение (окна не выходят вообще на проезжую часть!), Рядом: ТД Той Маркет, рынок Дархан, школы 94 и 22, ал…"
"2-комнатная квартира, 85 м², 11/18 этажВсе заметкиУдалить",https://krisha.kz//a/show/58047004,33 000 000〒,"Бостандыкский р-н, Розыбакиева 289",Алматы29 нояб.,"жил. комплекс Айгерим, монолитный дом, 2012 г.п., состояние: евроремонт, потолки 3м., санузел раздельный, телефон: отдельный, интернет оптика, частично меблирована, Светлая, просторная и современная квартира (спальня 25 кв. м., большая кухня и лоджия). Качественные материалы отделки квартиры: д…"
"2-комнатная квартира, 64.5 м², 15/16 этажВсе заметкиУдалить",https://krisha.kz//a/show/29145720,31 800 000〒,"Бостандыкский р-н, мкр Орбита-3, Торайгырова",Алматы29 нояб.,"В залоге, жил. комплекс Толе би Тау, монолитный дом, 2011 г.п., состояние: евроремонт, жил. площадь 45.2 кв.м., кухня 28.6 кв.м., санузел совмещенный, телефон: есть возможность подключения, интернет оптика, полностью меблирована, Квартира расположена в спальном районе Рядом в пешей доступности нах…"
"2-комнатная квартира, 75 м², 3/13 этажВсе заметкиУдалить",https://krisha.kz//a/show/663587311,46 000 000〒,"Бостандыкский р-н, Сейфуллина",Алматы29 нояб.,"В залоге, жил. комплекс NS – Tau, монолитный дом, 2016 г.п., состояние: хорошее, потолки 2.8м., санузел 2 с/у и более, полностью меблирована, Просторная квартира с отличным видом из окон! Большие комнаты позволят вам жить в комфорте и уюте. Большая утепленная лоджия с видом на город прекрасн…"
"2-комнатная квартира, 45 м², 5/5 этажВсе заметкиУдалить",https://krisha.kz//a/show/663223256,23 000 000〒,"Бостандыкский р-н, мкр Орбита-1, Мкр Орбита-1 — Мустафина",Алматы29 нояб.,"панельный дом, 1974 г.п., состояние: евроремонт, потолки 2.8м., санузел совмещенный, телефон: отдельный, интернет ADSL, полностью меблирована, Отличное предложение! Такого вы еще не видели, данное решение удивит каждого! Квартира с непревзойдённым дизайнерским решением в европейском стиле, в которо…"
"2-комнатная квартира, 70.8 м², 5/10 этажВсе заметкиУдалить",https://krisha.kz//a/show/663502464,31 860 000〒,"Бостандыкский р-н, мкр Алмагуль, Трамвайная — Катаева",Алматы29 нояб.,"жил. комплекс Galileo Terrace, монолитный дом, 2020 г.п., состояние: свободная планировка, потолки 2.8м., санузел совмещенный, телефон: есть возможность подключения, пустая, Улучшенная, счётчики, тихий двор. УСПЕЙТЕ КУПИТЬ КВАРТИРУ Квартиры на прямую от застройщика Продается 2-комнатная квартира…"
"2-комнатная квартира, 106 м², 16/17 этажВсе заметкиУдалить",https://krisha.kz//a/show/663528124,53 000 000〒,"Бостандыкский р-н, Розыбакиева 289 — Аль-Фараби",Алматы29 нояб.,"жил. комплекс Айгерим, монолитный дом, 2012 г.п., состояние: евроремонт, жил. площадь 52 кв.м., кухня 27 кв.м., потолки 2.8м., санузел раздельный, телефон: отдельный, интернет оптика, полностью меблирована, Продам 2х комнатную квартиру в ЖК Айгерим. Полностью мебелирована. Свежий ремонт 2017г. Зае…"
"2-комнатная квартира, 49.9 м², 2/10 этажВсе заметкиУдалить",https://krisha.kz//a/show/663609099,36 000 000〒,"Бостандыкский р-н, Володарского 40 — Тимирязева",Алматы29 нояб.,"жил. комплекс Forum Plus, монолитный дом, 2019 г.п., состояние: евроремонт, потолки 2.7м., санузел совмещенный, интернет ADSL, полностью меблирована, Встроенная бытовая техника, мебель. Теплая, светлая, окна на юг. Готова к заселению"
"2-комнатная квартира, 69 м², 10/16 этажВсе заметкиУдалить",https://krisha.kz//a/show/663612308,28 490 000〒,"Бостандыкский р-н, мкр Коктем-3, Мусрепова 22 — Сатпаева",Алматы29 нояб.,"жил. комплекс Central Esentai Residence, 2016 г.п., состояние: свободная планировка, Минимальная цена по комплексу! Отличная локация! Оптимальный блок! Окна на восток! Срочно! Горячее предложение! Полное сопровождение слелкм! Лучшие варианты по минимальным ценам в данном комплексе! Помощь…"
"2-комнатная квартира, 65 м², 2/10 этажВсе заметкиУдалить",https://krisha.kz//a/show/663325507,33 800 000〒,"Бостандыкский р-н, Кенесары хана 54/21",Алматы29 нояб.,"жил. комплекс Хан-Тенгри, монолитный дом, 2014 г.п., состояние: евроремонт, жил. площадь 38 кв.м., кухня 12 кв.м., потолки 3м., санузла нет, интернет ADSL, частично меблирована, Продам квартиру после ремонта ! Солнечную сторону ! Тёплую"
"2-комнатная квартира, 54 м², 5/13 этажВсе заметкиУдалить",https://krisha.kz//a/show/663453686,27 000 000〒,"Бостандыкский р-н, Навои 208 — Торайгырова",Алматы29 нояб.,"жил. комплекс Шахристан, монолитный дом, 2015 г.п., состояние: хорошее, потолки 3м., санузел совмещенный, интернет ADSL, полностью меблирована, Очень горячее предложение. Спешите. Преимущества ЖК Шахиристан. Два детских сада Качественная постройка Развитая инфраструктура Экологически чистый рай…"
"2-комнатная квартира, 90 м², 7/18 этажВсе заметкиУдалить",https://krisha.kz//a/show/662096592,36 000 000〒,"Бостандыкский р-н, Гагарина 133",Алматы29 нояб.,"жил. комплекс Өркендеу, монолитный дом, 2017 г.п., состояние: среднее, потолки 3м., санузел раздельный, телефон: отдельный, интернет ADSL, частично меблирована, Если Вы ищите квартиру в экологическом чистом районе с развитой инфраструктурой, то объект в ЖК «Өркендеу» привлечет Ваше внимание и…"
"2-комнатная квартира, 63 м², 1 этажВсе заметкиУдалить",https://krisha.kz//a/show/663615645,33 500 000〒,"Бостандыкский р-н, Абиша Кекилбаева 97А",Алматы29 нояб.,"В залоге, 2018 г.п., интернет ADSL, полностью меблирована, ЖК Аманат от BI Group, комфорт класса. торга нет, самая низкая цена в этом ЖК. С риэлторами не сотрудничаю. Цена действительна до Нового года. Всем удачных приобретений"
"2-комнатная квартира, 64.6 м², 4/16 этажВсе заметкиУдалить",https://krisha.kz//a/show/55667303,37 000 000〒,"Бостандыкский р-н, Байсеитовой — Сатпаева",Алматы29 нояб.,"монолитный дом, 1980 г.п., состояние: хорошее, жил. площадь 35.7 кв.м., потолки 2.8м., санузел раздельный, телефон: отдельный, интернет через TV кабель, частично меблирована, Представляем вашему вниманию 2-х комнатную квартиру с лоджией в каждой из них, включая уютную кухню, расположенную в од…"
"2-комнатная квартира, 45 м², 4/4 этажВсе заметкиУдалить",https://krisha.kz//a/show/663615850,16 600 000〒,"Бостандыкский р-н, Жарокова — Жандосова",Алматы29 нояб.,"кирпичный дом, 1965 г.п., состояние: хорошее, санузел совмещенный, телефон: отдельный, частично меблирована, Планировка ""вагончик"", неугловая, в хорошем состоянии"
"2-комнатная квартира, 45 м², 2/5 этажВсе заметкиУдалить",https://krisha.kz//a/show/663563208,18 300 000〒,"Бостандыкский р-н, мкр Орбита-4, Мкр Орбита-4 — Габидена Мустафина-Торайгырова",Алматы29 нояб.,"панельный дом, 1978 г.п., состояние: среднее, санузел раздельный, пустая, Дом во дворах. Планировка вагончик. Окна на обе стороны. Не в залоге. Документы в порядке. Двор и детская площадка отремонтирована. Рядом Ясли-сад №89, Солнышко частный детский сад, Частная школа- лицей Лиде…"
"2-комнатная квартира, 50 м², 3/5 этажВсе заметкиУдалить",https://krisha.kz//a/show/663615479,24 000 000〒,"Бостандыкский р-н, Брусиловского 260",Алматы29 нояб.,"панельный дом, 1978 г.п., состояние: среднее, жил. площадь 31 кв.м., кухня 11 кв.м., потолки 2.8м., санузел совмещенный, частично меблирована, Дом стоит между Джандосова и Сатпаева, удобные подьездные пути, рядом протекает речка, хороший большой двор, много места для парковки машин, рядом ТЦ АДК…"
"2-комнатная квартира, 45 м², 5/5 этажВсе заметкиУдалить",https://krisha.kz//a/show/663618269,17 900 000〒,"Бостандыкский р-н, мкр Орбита-2, Мкр Орбита-2",Алматы29 нояб.,"панельный дом, 1976 г.п., состояние: требует ремонта, санузел раздельный, Не угловая, счётчики, тихий двор. Продается 2-х комнатная квартира в Орбите 2 по ул. Биржана. Не угловая, в залоге не состоит. Документы в полном порядке. Очень теплая. Рядом парк президента. Тихий двор. Дружелюбные сосед…"
"2-комнатная квартира, 43 м², 2/2 этажВсе заметкиУдалить",https://krisha.kz//a/show/663618006,18 000 000〒,"Бостандыкский р-н, мкр Алмагуль, Мкр Алмагуль 1 — Гагарина-переулок Дружбы",Алматы29 нояб.,"кирпичный дом, 1960 г.п., состояние: хорошее, потолки 2.5м., санузел совмещенный, телефон: отдельный, интернет через TV кабель, полностью меблирована, Уютная квартира, тихий двор, навес для автомобиля. Рядом садик и школа. Возможно обмен на трехкомнатную в этом районе или Орбите"
"2-комнатная квартира, 61 м², 8/10 этажВсе заметкиУдалить",https://krisha.kz//a/show/663359208,35 000 000〒,"Бостандыкский р-н, Гагарина 309",Алматы29 нояб.,"жил. комплекс Комфорт, монолитный дом, 2018 г.п., состояние: черновая отделка, санузел совмещенный, телефон: отдельный, интернет ADSL, пустая, Срочно! Вид на горы!"
"2-комнатная квартира, 43 м², 2/5 этажВсе заметкиУдалить",https://krisha.kz//a/show/57239629,22 000 000〒,"Бостандыкский р-н, мкр Орбита-1, Навои — Торайгырова",Алматы29 нояб.,"панельный дом, 1974 г.п., состояние: евроремонт, жил. площадь 27 кв.м., кухня 6 кв.м., потолки 2.6м., санузел совмещенный, телефон: есть возможность подключения, интернет ADSL, полностью меблирована, Уютная квартира после недавнего капитального ремонта в 3 минутах ходьбы гос дет сад 80 и гимназ…"
"2-комнатная квартира, 42.6 м², 5/5 этажВсе заметкиУдалить",https://krisha.kz//a/show/662879045,21 700 000〒,"Бостандыкский р-н, Сатпаева 78 — Егизбаева",Алматы29 нояб.,"панельный дом, 1974 г.п., состояние: хорошее, жил. площадь 26.5 кв.м., кухня 6 кв.м., потолки 2.6м., санузел совмещенный, интернет ADSL, частично меблирована, Продается квартира, в хорошем состоянии, в центре города, с развитой инфраструктурой. В шаговой доступности ТРЦ АДК, супермаркет Смолл, Бекк…"
"2-комнатная квартира, 61.9 м², 5/12 этажВсе заметкиУдалить",https://krisha.kz//a/show/663617655,26 420 000〒,"Бостандыкский р-н, мкр Орбита-3, Торайгырова 19 — Мустафина",Алматы29 нояб.,"жил. комплекс Sholpan City, монолитный дом, 2020 г.п., состояние: свободная планировка, санузел 2 с/у и более, В связи с переездом"
"2-комнатная квартира, 66.61 м², 5/5 этажВсе заметкиУдалить",https://krisha.kz//a/show/662441101,26 000 000〒,"Бостандыкский р-н, мкр Орбита-3",Алматы29 нояб.,"кирпичный дом, 1989 г.п., состояние: хорошее, жил. площадь 30.6 кв.м., кухня 11.2 кв.м., санузел раздельный, частично меблирована"
"2-комнатная квартира, 58 м², 1/5 этажВсе заметкиУдалить",https://krisha.kz//a/show/663617480,26 000 000〒,"Бостандыкский р-н, Басенова — Розыбакиева",Алматы29 нояб.,"кирпичный дом, 1987 г.п., состояние: хорошее, жил. площадь 32 кв.м., кухня 12 кв.м., санузел раздельный, частично меблирована, В продаже 2-комнатная квартира в хорошем состоянии. Престижный, экологически чистый район. Развитая инфраструктура, рядом школа-гимназия, детсад, продуктовые магазины…"
"2-комнатная квартира, 42 м², 4/4 этажВсе заметкиУдалить",https://krisha.kz//a/show/663617143,18 000 000〒,"Бостандыкский р-н, Тимирязева — Радостовца",Алматы29 нояб.,"кирпичный дом, 1962 г.п., состояние: хорошее, санузел совмещенный, телефон: отдельный, интернет оптика, частично меблирована, Внимание! Продаётся двухкомнатная квартира обычной планировки в одном из самых востребованных районов города! -Квартира в хорошем состоянии! Не требует капитальных вложений!…"
"2-комнатная квартира, 60 м², 7/9 этажВсе заметкиУдалить",https://krisha.kz//a/show/663617385,26 000 000〒,"Бостандыкский р-н, мкр Орбита-3, Мкр Орбита-3 — Торайгырова",Алматы29 нояб.,"панельный дом, 1976 г.п., состояние: хорошее, жил. площадь 30 кв.м., кухня 7 кв.м., санузел раздельный, частично меблирована, В продаже 2-комнатная квартира в хорошем состоянии. Улучшенная планировка. Престижный, развитый район. Рядом школы, детсады, продуктовые магазины, автобусные остановки…"
"2-комнатная квартира, 58.2 м², 10/12 этажВсе заметкиУдалить",https://krisha.kz//a/show/663477437,29 000 000〒,"Бостандыкский р-н, Сатпаева 90",Алматы29 нояб.,"жил. комплекс Симфония, монолитный дом, 2017 г.п., состояние: черновая отделка, санузел совмещенный, ЖК «Симфония» Комфорт класса, в г. Алматы - проект СК «Базис-А». Находится ЖК на ул. Сатпаева, рядом с набережной реки Большая Алматинка. Новостройки имеют удачное расположение и великолепную трансп…"
"2-комнатная квартира, 42 м², 3/5 этажВсе заметкиУдалить",https://krisha.kz//a/show/663617104,20 000 000〒,"Бостандыкский р-н, мкр Казахфильм, Мкр Казахфильм",Алматы29 нояб.,"панельный дом, 1977 г.п., состояние: хорошее, санузел совмещенный, телефон: отдельный, интернет оптика, Внимание! Продаётся двухкомнатная квартира обычной планировки в одном из самых востребованных районов города! -Квартира в хорошем состоянии! Не требует капитальных вложений! - Развит…"
"2-комнатная квартира, 45 м², 2/4 этажВсе заметкиУдалить",https://krisha.kz//a/show/663617060,21 400 000〒,"Бостандыкский р-н, Жарокова — Жандосова",Алматы29 нояб.,"кирпичный дом, 1964 г.п., состояние: хорошее, санузел совмещенный, телефон: отдельный, интернет оптика, Внимание! Продаётся двухкомнатная квартира обычной планировки в одном из самых востребованных районов города! -Квартира в хорошем состоянии! Не требует капитальных вложений! - Развит…"
"2-комнатная квартира, 54 м², 1/5 этажВсе заметкиУдалить",https://krisha.kz//a/show/663617244,24 500 000〒,"Бостандыкский р-н, Сатпаева — Розыбакиева",Алматы29 нояб.,"панельный дом, 1983 г.п., состояние: хорошее, жил. площадь 30 кв.м., кухня 10 кв.м., санузел совмещенный, интернет ADSL, частично меблирована, В продаже 2-комнатная квартира в хорошем состоянии. Теплая, ухоженная. Улучшенная планировка. Ленинградский проект. Высокий цокольный этаж. Полы в жилых ком…"
"2-комнатная квартира, 66.6 м², 5/5 этажВсе заметкиУдалить",https://krisha.kz//a/show/663617178,24 000 000〒,"Бостандыкский р-н, мкр Орбита-3, Мкр Орбита-3 — Габидена Мустафина",Алматы29 нояб.,"панельный дом, 1989 г.п., состояние: хорошее, жил. площадь 30.6 кв.м., кухня 10 кв.м., санузел раздельный, полностью меблирована, В продаже 2-комнатная квартира в хорошем состоянии. Престижный, развитый район. Год постройки 1989! В шаговой доступности магазины, детсад, больница, школы. Непода…"
"2-комнатная квартира, 42.5 м², 1/2 этажВсе заметкиУдалить",https://krisha.kz//a/show/663181366,15 000 000〒,"Бостандыкский р-н, Байтурсынова — Бухар Жырау",Алматы29 нояб.,"кирпичный дом, 1952 г.п., состояние: среднее, жил. площадь 28.1 кв.м., кухня 9.9 кв.м., потолки 2.6м., санузел совмещенный, телефон: отдельный, полностью меблирована, Продается уютная и теплая квартира в центре города. В шаговой доступности университеты КазНТУ и АУЭС, гимназии №21 и №138, детск…"
