Заголовок,ссылка,Цена,Адрес,Дата,comment
"2-комнатная квартира, 63.8 м²Все заметкиУдалить",https://krisha.kz//a/show/50677087,от 31 262 000〒,"Алмалинский р-н, Шевченко 130ИпотекаИпотекаКвартиры, которые можноприобрести в ипотекуот банков и по гос.программам",Алматы29 нояб.,"жил. комплекс Lamiya, 13 этажей, 2020 г.п., жил. площадь 31.2 кв.м., кухня 13.2 кв.м., потолки 3м., санузел 2 с/у и более, ЖК Lamiya – это новый взгляд на старый культурный центр Алматы. Футуристичный фасад и множество коммерческих объектов, которые появятся сразу после запуска жилого комплек…"
"2-комнатная квартира, 53 м², 4/5 этажВсе заметкиУдалить",https://krisha.kz//a/show/663119153,26 500 000〒,"Алмалинский р-н, Ади Шарипова 129",Алматы29 нояб.,"кирпичный дом, 1977 г.п., состояние: хорошее, санузел раздельный, телефон: отдельный, интернет оптика, частично меблирована, Внимание! Продаётся квартира с шикарной планировкой, в центре города. Все коммуникации в шаговой доступности, очень удобное местоположение. Шикарный, тихий двор. Идеальные с…"
"2-комнатная квартира, 77 м², 10/22 этажВсе заметкиУдалить",https://krisha.kz//a/show/662626968,65 500 000〒,"Алмалинский р-н, Кабанбай батыра 87 — проспект Абылай Хана",Алматы29 нояб.,"жил. комплекс Столичный Центр, монолитный дом, 2005 г.п., состояние: хорошее, санузел 2 с/у и более, телефон: отдельный, интернет через TV кабель, частично меблирована, Базис"
"2-комнатная квартира, 47 м², 1/12 этажВсе заметкиУдалить",https://krisha.kz//a/show/663522581,32 000 000〒,"Алмалинский р-н, Манаса 109а — проспект Абая",Алматы29 нояб.,"жил. комплекс LEGENDA, монолитный дом, 2018 г.п., состояние: хорошее, санузел совмещенный, частично меблирована"
"2-комнатная квартира, 60 м², 3/3 этажВсе заметкиУдалить",https://krisha.kz//a/show/663153029,34 000 000〒,"Алмалинский р-н, проспект Абылай Хана — Жамбыла",Алматы29 нояб.,"кирпичный дом, 1970 г.п., жил. площадь 38 кв.м., кухня 8.5 кв.м., Эксклюзивное предложение от компании ""Atrium home"". Вашему вниманию предлагается замечательная квартира в одном из лучших районов АЛМАТЫ, в ЗОЛОТОМ КВАДРАТЕ! В шаговой доступности самые лучшие школы и детские сады горо…"
"2-комнатная квартира, 63.2 м², 3/3 этажВсе заметкиУдалить",https://krisha.kz//a/show/51822210,30 000 000〒,"Алмалинский р-н, Ади Шарипова 86. — Кабанбай батыра",Алматы29 нояб.,"кирпичный дом, 1956 г.п., состояние: хорошее, жил. площадь 36 кв.м., кухня 6.4 кв.м., потолки 3.2м., санузел раздельный, телефон: нет, интернет оптика, пустая, Продается 2х комнатная квартира в центре Алмалинского района, кирпичном доме, большой площади, улучшенной планировки совминовском дом…"
"2-комнатная квартира, 62.3 м², 5/9 этажВсе заметкиУдалить",https://krisha.kz//a/show/663564185,26 000 000〒,"Алмалинский р-н, Молдагулова 32 — Абылайхана",Алматы29 нояб.,"монолитный дом, 1979 г.п., состояние: евроремонт, потолки 2.8м., санузел совмещенный, телефон: отдельный, полностью меблирована, Продам 2х комнатную квартиру на Абылайхана Молдагулова. Квартира очень теплая и хорошая!Тёплые полы, встроенная кухня, доброжелательные соседи!Рядом Арбат, ТЮЗ, ЦУМ, ГУМ…"
"2-комнатная квартира, 43 м², 4/5 этажВсе заметкиУдалить",https://krisha.kz//a/show/663168753,21 500 000〒,"Алмалинский р-н, Нурмакова 51 — Казыбек би",Алматы29 нояб.,"кирпичный дом, 1982 г.п., состояние: хорошее, санузел раздельный, телефон: есть возможность подключения, интернет оптика, полностью меблирована, Срочно продаётся тёплая, чистая, уютная квартира в центре города! Ул. Нурмакова между Гоголя и Казыбек би. Новая бытовая техника, фирмы (BOSCH, LG, SAMS…"
"2-комнатная квартира, 45 м²Все заметкиУдалить",https://krisha.kz//a/show/663300691,от 24 300 000〒,"Алмалинский р-н, Варламова 1/3ИпотекаИпотекаКвартиры, которые можноприобрести в ипотекуот банков и по гос.программам",Алматы29 нояб.,"жил. комплекс Varlamova, 13 этажей, 2020 г.п., потолки 3м., санузел совмещенный, Готовые квартиры с дизайнерским ремонтом и мебелью IKEA в уникальном ЖК Varlamova, расположенном в Алмалинском районе между проспектом Абая и ул. Толе Би, в непосредственной близости от парка отдыха «Озе…"
"2-комнатная квартира, 53 м², 5/5 этажВсе заметкиУдалить",https://krisha.kz//a/show/56757966,18 000 000〒,"Алмалинский р-н, мкр Тастак-2, Тастак 2",Алматы29 нояб.,"панельный дом, 1982 г.п., состояние: хорошее, потолки 2.75м., санузел раздельный, телефон: отдельный, интернет ADSL, частично меблирована, Продам улучшенную квартиру в хорошем состоянии, комнаты изолированы, с/у раздельный. Дом находится во дворах, детские площадки. тихий и спокойный район. в шагов…"
"2-комнатная квартира, 51 м², 2/9 этажВсе заметкиУдалить",https://krisha.kz//a/show/662780419,30 000 000〒,"Алмалинский р-н, Шевченко 129 — Муканова",Алматы29 нояб.,"В залоге, кирпичный дом, 1989 г.п., состояние: хорошее, жил. площадь 31 кв.м., кухня 8 кв.м., потолки 2.7м., санузел раздельный, телефон: отдельный, интернет через TV кабель, частично меблирована, Продаю 2-х комнатную квартиру в центре, дом кирпичный, 1989 года, 2 этаж, первом этаже нет квартиры…"
"2-комнатная квартира, 48 м², 8/13 этажВсе заметкиУдалить",https://krisha.kz//a/show/663223428,26 000 000〒,"Алмалинский р-н, Варламова 1/3 — Толе би",Алматы29 нояб.,"жил. комплекс Varlamova, монолитный дом, 2020 г.п., состояние: евроремонт, потолки 3м., санузел совмещенный, полностью меблирована, 💥Внимание!💥Внимание!💥Внимание! ПРОХОДИТ ПО ПРОГРАММАМ: 7/20/25, БАСПАНА ХИТ, ЖССБ и конечно же за НАЛИЧНЫЙ РАСЧЕТ! БОЛЬШОЕ ПРЕИМУЩЕСТВО: ПО ПРОГРАММЕ 7 20 25 гото…"
"2-комнатная квартира, 56 м², 9/9 этажВсе заметкиУдалить",https://krisha.kz//a/show/660072483,25 000 000〒,"Алмалинский р-н, Молдагуловой 32 — проспект Абылай Хана",Алматы29 нояб.,"кирпичный дом, 1974 г.п., состояние: хорошее, жил. площадь 36 кв.м., кухня 17 кв.м., потолки 2.8м., санузел раздельный, телефон: отдельный, интернет ADSL, полностью меблирована, Продаю свою любимую квартиру. Квартира очень теплая, сухая, тихая. Зимой очень тепло. Не смотря на центр, очень тихо…"
"2-комнатная квартира, 60 м², 8/9 этажВсе заметкиУдалить",https://krisha.kz//a/show/661105467,28 700 000〒,"Алмалинский р-н, Гагарина — Толе би",Алматы29 нояб.,"монолитный дом, 1985 г.п., состояние: евроремонт, жил. площадь 33 кв.м., кухня 11.4 кв.м., потолки 2.85м., санузел раздельный, телефон: есть возможность подключения, частично меблирована, Продаётся 2-х комнатная квартира на Гагарина-Толе би, высокие потолки, светлые большие комнаты, входная 10кв…"
"2-комнатная квартира, 72 м², 8/13 этажВсе заметкиУдалить",https://krisha.kz//a/show/663059866,41 000 000〒,"Алмалинский р-н, Сейфуллина 499 — Жибек жолы",Алматы29 нояб.,"жил. комплекс Бакытты омир, 2017 г.п., состояние: евроремонт, потолки 2.8м., полностью меблирована, 2-х км переделанная в трёшку Все рядом в центре города"
"2-комнатная квартира, 51.2 м²Все заметкиУдалить",https://krisha.kz//a/show/50677684,от 25 088 000〒,"Алмалинский р-н, Шевченко 130ИпотекаИпотекаКвартиры, которые можноприобрести в ипотекуот банков и по гос.программам",Алматы29 нояб.,"жил. комплекс Lamiya, 13 этажей, 2020 г.п., жил. площадь 25.5 кв.м., кухня 9.9 кв.м., потолки 3м., санузел совмещенный, ЖК Lamiya – это новый взгляд на старый культурный центр Алматы. Футуристичный фасад и множество коммерческих объектов, которые появятся сразу после запуска жилого комплек…"
"2-комнатная квартира, 45 м², 4/5 этажВсе заметкиУдалить",https://krisha.kz//a/show/663588982,17 800 000〒,"Алмалинский р-н, Шарипова Ади (Мечникова) — Макатаева (Пастера)",Алматы29 нояб.,"панельный дом, 1974 г.п., состояние: хорошее, жил. площадь 28 кв.м., кухня 6 кв.м., санузел совмещенный, телефон: отдельный, интернет ADSL, частично меблирована, СРОЧНО! ТОРГ минимальный. Средний этаж, Не угловая, самая просторная планировка Вагончик, комнаты расположены в две стороны дома, чт…"
"2-комнатная квартира, 77.5 м², 9/23 этажВсе заметкиУдалить",https://krisha.kz//a/show/663468315,77 500 000〒,"Алмалинский р-н, Абылайхана 92 — Кабанбай батыра",Алматы29 нояб.,"жил. комплекс Столичный Центр, 2007 г.п., полностью меблирована, Уютная, красивая, чистая квартира со свежим ремонтом, все делали для себя, квартира никогда не сдавалась. Сантехника Crohe, телевизор Sony, шикарный вид на горы, отдельная кладовая в паркинге (удобно под лыжи, резину, велосипед и тд )"
"2-комнатная квартира, 54 м², 3/9 этажВсе заметкиУдалить",https://krisha.kz//a/show/663182219,28 000 000〒,"Алмалинский р-н, улица Молдагуловой 32 — Проспект Абылай Хана",Алматы29 нояб.,"панельный дом, 1979 г.п., жил. площадь 42 кв.м., кухня 7.5 кв.м., потолки 2.8м., санузел раздельный, телефон: отдельный, интернет проводной, частично меблирована, Прекрасное расположение. Центр, рядом Арбат и пешеходная зона на Панфилова, театр, кинотеатры и торговые центры. Напротив красивый скве…"
"2-комнатная квартира, 53 м², 4/5 этажВсе заметкиУдалить",https://krisha.kz//a/show/663119759,26 500 000〒,"Алмалинский р-н, Ади Шарипова 129",Алматы29 нояб.,"кирпичный дом, 1977 г.п., состояние: хорошее, санузел раздельный, телефон: отдельный, интернет оптика, частично меблирована, Продается отличная 2х комнатная квартира в кирпичном доме на Ади Шарипова - Жамбыла. Что хорошо, это его расположение, рядом находится центральный стадион, маркеты, магазины…"
"2-комнатная квартира, 53 м², 7/9 этажВсе заметкиУдалить",https://krisha.kz//a/show/662574624,28 500 000〒,"Алмалинский р-н, Байзакова 232 — Жамбыла",Алматы29 нояб.,"панельный дом, 1988 г.п., состояние: хорошее, санузел раздельный, интернет проводной, полностью меблирована"
"2-комнатная квартира, 53 м², 1/5 этажВсе заметкиУдалить",https://krisha.kz//a/show/663605294,26 800 000〒,"Алмалинский р-н, Досмухамедова 117 — Абая",Алматы29 нояб.,"кирпичный дом, 1975 г.п., состояние: хорошее, потолки 2.7м., санузел раздельный, интернет через TV кабель, полностью меблирована, Квартира находится в центре города все Развязки по всему городу транспортов Метро рядом Центральный стадион Балуан Шолак Спорткомплекс променад супермаркет магнум все…"
"2-комнатная квартира, 48 м², 2/4 этажВсе заметкиУдалить",https://krisha.kz//a/show/51057669,18 500 000〒,"Алмалинский р-н, Ауезова 64/2 — Шевченко",Алматы29 нояб.,"панельный дом, 1965 г.п., состояние: хорошее, жил. площадь 32 кв.м., кухня 6 кв.м., частично меблирована, Продам 2 ком кв в центре города, престижном районе. Светлая, уютная, теплая квартира. Экологический чистый дом, окно, пол сделано из натурального дерево. Зимой тепло, летом прохладно без всяк…"
"2-комнатная квартира, 45 м², 4/5 этажВсе заметкиУдалить",https://krisha.kz//a/show/663585988,17 800 000〒,"Алмалинский р-н, Ади Шарипова — Макатаева",Алматы29 нояб.,"панельный дом, 1974 г.п., состояние: среднее, жил. площадь 28 кв.м., кухня 6 кв.м., санузел раздельный, СРОЧНО! ТОРГ минимальный. Средний этаж, Не угловая, самая просторная планировка Вагончик, комнаты расположены в две стороны дома, что обеспечивает отличную проветриваемость помещения. Ест…"
"2-комнатная квартира, 42.3 м², 2/5 этажВсе заметкиУдалить",https://krisha.kz//a/show/663475163,20 800 000〒,"Алмалинский р-н, Муратбаева — Гоголя",Алматы29 нояб.,"панельный дом, 1976 г.п., состояние: среднее, жил. площадь 27.7 кв.м., кухня 6 кв.м., потолки 2.5м., санузел совмещенный, телефон: отдельный, пустая, Срочно! 2-х комнатная квартира в панельном доме, квартира угловая однако очень теплая, пластиковые окна, балкон застеклен, на окнах и на балкон…"
"2-комнатная квартира, 44.6 м², 3/4 этажВсе заметкиУдалить",https://krisha.kz//a/show/663588043,29 000 000〒,"Алмалинский р-н, Наурызбай Батыра 21 — Макатаева",Алматы29 нояб.,"панельный дом, 1980 г.п., состояние: евроремонт, жил. площадь 30.8 кв.м., кухня 5.1 кв.м., потолки 2.7м., санузел совмещенный, телефон: отдельный, интернет оптика, полностью меблирована, 2-х комнатная квартира на пересечении улиц Наурызбай Батыра и Макатаева ""золотой квадрат"". Дом…"
"2-комнатная квартира, 55 м², 5/16 этажВсе заметкиУдалить",https://krisha.kz//a/show/660449999,25 000 000〒,"Алмалинский р-н, Райымбека 206/12",Алматы29 нояб.,"жил. комплекс ЖК на Ташкентской, монолитный дом, 2019 г.п., состояние: хорошее, потолки 2.7м., санузел совмещенный, интернет ADSL, частично меблирована, Квартира тёплая, уютная, светлая Окна выходят как во двор(юго-восточная сторона) так и в город (западная сторона) Не в залоге, все документ…"
"2-комнатная квартира, 61.8 м²Все заметкиУдалить",https://krisha.kz//a/show/50677117,от 30 282 000〒,"Алмалинский р-н, Шевченко 130ИпотекаИпотекаКвартиры, которые можноприобрести в ипотекуот банков и по гос.программам",Алматы29 нояб.,"жил. комплекс Lamiya, 13 этажей, 2020 г.п., жил. площадь 36.6 кв.м., кухня 6.9 кв.м., потолки 3м., санузел раздельный, ЖК Lamiya – это новый взгляд на старый культурный центр Алматы. Футуристичный фасад и множество коммерческих объектов, которые появятся сразу после запуска жилого комплек…"
"2-комнатная квартира, 72 м², 8/18 этажВсе заметкиУдалить",https://krisha.kz//a/show/663475760,46 000 000〒,"Алмалинский р-н, Брусиловского 159 блок 4",Алматы29 нояб.,"жил. комплекс Алтын Булак 1, монолитный дом, 2012 г.п., состояние: евроремонт, потолки 2.8м., санузел совмещенный, телефон: отдельный, интернет ADSL, полностью меблирована"
"2-комнатная квартира, 55 м², 5/9 этажВсе заметкиУдалить",https://krisha.kz//a/show/663577065,24 500 000〒,"Алмалинский р-н, Молдагуловой — Абылай хана",Алматы29 нояб.,"монолитный дом, 1978 г.п., состояние: хорошее, санузел совмещенный, частично меблирована, ИТАЛЬЯНСКИЙ проек"
"2-комнатная квартира, 53 м², 3/5 этажВсе заметкиУдалить",https://krisha.kz//a/show/661649138,22 800 000〒,"Алмалинский р-н, мкр Тастак-2, Мкр Тастак-2 2",Алматы29 нояб.,"панельный дом, 1987 г.п., состояние: хорошее, санузел раздельный, интернет оптика, полностью меблирована, Продажа от хозяина! торг на месте при осмотре! Квартира улучшенной планировки - большая кухня 12кв! Светлая, уютная, чистая, в хорошем состоянии. Полностью обставлена - имеется вся мебел…"
"2-комнатная квартира, 76.7 м², 18/18 этажВсе заметкиУдалить",https://krisha.kz//a/show/55397176,32 000 000〒,"Алмалинский р-н, Брусиловского 159/6 — Кулымбетова",Алматы29 нояб.,"жил. комплекс Алтын Булак 1, монолитный дом, 2011 г.п., состояние: хорошее, жил. площадь 43.4 кв.м., кухня 6.5 кв.м., потолки 2.8м., санузел совмещенный, телефон: есть возможность подключения, интернет проводной, полностью меблирована, Маклеров и посредников просьба не беспокоить. Сделан капитальн…"
"2-комнатная квартира, 53 м², 7/9 этажВсе заметкиУдалить",https://krisha.kz//a/show/663589348,23 500 000〒,"Алмалинский р-н, Абая — Жарокова",Алматы29 нояб.,"кирпичный дом, 1985 г.п., состояние: среднее, санузел раздельный, частично меблирована, Продается 2-комнатная квартира улучшенной планировки. Комнаты изолированы. Этаж средний. Рядом станция метро Алатау"
"2-комнатная квартира, 45 м², 5/5 этажВсе заметкиУдалить",https://krisha.kz//a/show/662853715,24 500 000〒,"Алмалинский р-н, Гоголя 117 — Мауленова",Алматы29 нояб.,"кирпичный дом, 1968 г.п., состояние: евроремонт, жил. площадь 32 кв.м., кухня 6.2 кв.м., потолки 2.7м., санузел совмещенный, телефон: отдельный, интернет оптика, полностью меблирована, Продается 2-х комнатная квартира в шикарном районе, стоимость недвижимости в котором с годами только дорожае…"
"2-комнатная квартира, 53 м², 4/5 этажВсе заметкиУдалить",https://krisha.kz//a/show/663445041,26 500 000〒,"Алмалинский р-н, Ади Шарипова — Жамбыла",Алматы29 нояб.,"кирпичный дом, 1977 г.п., состояние: хорошее, санузел раздельный, телефон: отдельный, интернет ADSL, пустая, Рады представить вам отличное предложение, на среднем этаже! Дом кирпичный в рекламе не нуждается! Квартира просторная, светлая, чистая. В непосредственной близости Вы найдете все…"
