Заголовок,ссылка,Цена,Адрес,Дата,comment
"4-комнатная квартира, 128 м², 3/3 этажВсе заметкиУдалить",https://krisha.kz//a/show/57449259,67 300 000〒,"Алмалинский р-н, Шевченко 51 — Панфилова",Алматы28 нояб.,"кирпичный дом, 1958 г.п., состояние: хорошее, санузел 2 с/у и более, телефон: отдельный, интернет через TV кабель, полностью меблирована, Срочно"
"4-комнатная квартира, 94 м², 4/9 этажВсе заметкиУдалить",https://krisha.kz//a/show/57638976,48 000 000〒,"Алмалинский р-н, проспект Сакена Сейфуллина 577 — Шевченко",Алматы28 нояб.,"кирпичный дом, 1994 г.п., состояние: хорошее, санузел 2 с/у и более, телефон: отдельный, интернет через TV кабель, частично меблирована"
"4-комнатная квартира, 88 м², 4/5 этажВсе заметкиУдалить",https://krisha.kz//a/show/661997243,53 000 000〒,"Алмалинский р-н, Казыбек би 78 — Наурызбай Батыра",Алматы28 нояб.,"кирпичный дом, 1980 г.п., состояние: хорошее, жил. площадь 54 кв.м., кухня 9 кв.м., санузел раздельный, телефон: отдельный, интернет через TV кабель, частично меблирована, Дом во дворах"
"4-комнатная квартира, 114 м², 16/21 этажВсе заметкиУдалить",https://krisha.kz//a/show/663599684,60 000 000〒,"Алмалинский р-н, мкр Тастак-2, Толе Би 286/8 — Тлендиева",Алматы28 нояб.,"жил. комплекс Каусар, монолитный дом, 2011 г.п., жил. площадь 92 кв.м., кухня 10 кв.м., Код объекта: 4984455 Развитую инфраструктура. Она включает наличие фитнес-центра, турагентства, магазинов детских товаров и домашнего текстиля, супермаркета. На придомовой территории, которая огорожена и…"
"4-комнатная квартира, 94 м², 3/5 этажВсе заметкиУдалить",https://krisha.kz//a/show/663522098,43 000 000〒,"Алмалинский р-н, Розыбакиева — Курмангазы",Алматы28 нояб.,"кирпичный дом, 1989 г.п., состояние: евроремонт, потолки 2.8м., полностью меблирована, Вашему вниманию Агентство Недвижимости ""Qubiq"" Предоставляет вам шикарную квартиру практически в центре города! С прекрасно развитой инфраструктурой! в ведомственном кирпично-ригельном доме, кото…"
"4-комнатная квартира, 118 м², 4/13 этажВсе заметкиУдалить",https://krisha.kz//a/show/661270060,57 000 000〒,"Алмалинский р-н, Макатаева 131",Алматы28 нояб.,"жил. комплекс Atlant, монолитный дом, 2020 г.п., состояние: евроремонт, жил. площадь 85 кв.м., кухня 12 кв.м., потолки 2.7м., санузел 2 с/у и более, интернет ADSL, полностью меблирована, Продам 4 квартиру в ЖК Атлант качественный ремонт под ключ, полностью меблированная, вся бытовая техника. За…"
"4-комнатная квартира, 74.1 м², 4/4 этажВсе заметкиУдалить",https://krisha.kz//a/show/663599306,26 500 000〒,"Алмалинский р-н, Казыбек би — Исаева",Алматы28 нояб.,"панельный дом, 1970 г.п., состояние: хорошее, жил. площадь 53 кв.м., кухня 8.7 кв.м., санузел раздельный, частично меблирована, Продается 4-комн квартира улучшенной планировки в самом востребованном районе Южной столицы по супердоступной цене. Квартира светлая, просторная, чистая, очень уютная. Кв…"
"4-комнатная квартира, 86 м², 5/5 этажВсе заметкиУдалить",https://krisha.kz//a/show/20477411,34 000 000〒,"Алмалинский р-н, Розыбакиева 70 — Кабанбай батыра (Калинина)",Алматы28 нояб.,"кирпичный дом, 1982 г.п., состояние: хорошее, санузел раздельный, телефон: отдельный, интернет ADSL, полностью меблирована, Кирпичный дом 1982 г.п. Улучшенная планировка, двойная дверь, 2 лоджии, 2 балкона (утепленные, застекленные), алюминиевые радиаторы отопления. Квартира светлая, теплая, ую…"
"4-комнатная квартира, 74 м², 2/5 этажВсе заметкиУдалить",https://krisha.kz//a/show/663597962,27 500 000〒,"Алмалинский р-н, Дуйсенова — Туркебаева",Алматы28 нояб.,"В залоге, панельный дом, 1986 г.п., состояние: среднее, жил. площадь 56 кв.м., кухня 9 кв.м., санузел совмещенный, телефон: отдельный, частично меблирована, Продается четырехкомнатная квартира с изолированными комнатами в тихом дворе рядом в двух шагах сквер для прогулки. Квартира полностью гото…"
"4-комнатная квартира, 215 м², 5/6 этажВсе заметкиУдалить",https://krisha.kz//a/show/28514398,340 000 000〒,"Алмалинский р-н, Чайковского 149 — проспект Абая",Алматы28 нояб.,"жил. комплекс Базис на Чайковского, монолитный дом, 2014 г.п., состояние: евроремонт, санузел 2 с/у и более, телефон: отдельный, полностью меблирована, Продам квартиру в самом лучшем модном, клубном, доме в сердце Алматы. Квартира в очень хорошем, ухоженным состояний, в квартире сделан ре…"
"4-комнатная квартира, 80.9 м², 5/5 этажВсе заметкиУдалить",https://krisha.kz//a/show/663291801,30 000 000〒,"Алмалинский р-н, мкр Тастак-2, Мкр Тастак-2",Алматы28 нояб.,"кирпичный дом, 1989 г.п., состояние: среднее, потолки 2.7м., санузел раздельный, Горячее предложение от Управляющей компании Галерея недвижимости! Хорошая большая квартира на среднем этаже с выходом Юг- Север. Район очень удобный и жить в нем будет очень комфортно, а именно: рынок Тастак, оптовк…"
"4-комнатная квартира, 145 м², 12/14 этажВсе заметкиУдалить",https://krisha.kz//a/show/662046446,84 000 000〒,"Алмалинский р-н, Айманова — Жамбыла",Алматы28 нояб.,"монолитный дом, 2011 г.п., состояние: евроремонт, санузел 2 с/у и более, телефон: отдельный, интернет оптика, частично меблирована, №416-2 Предлагаю Вашему вниманию на продажу 4-х комнатную квартиру в жилом комплексе в центре города. Удобная планировка квартиры общей квадратурой 145 кв…"
"4-комнатная квартира, 90 м², 5/5 этажВсе заметкиУдалить",https://krisha.kz//a/show/663596899,36 500 000〒,"Алмалинский р-н, Толе Би — Нурмакова",Алматы28 нояб.,"кирпичный дом, 1987 г.п., состояние: евроремонт, жил. площадь 60 кв.м., кухня 12 кв.м., санузел 2 с/у и более, полностью меблирована, Продается 4х комнатная квартира в Алмалинском районе Южной Столицы. Очень удобное расположение развитая инфраструктура: учебные и дошкольные заведения, транспор…"
"4-комнатная квартира, 80.9 м², 5/5 этажВсе заметкиУдалить",https://krisha.kz//a/show/663280170,30 000 000〒,"Алмалинский р-н, мкр Тастак-2, Мкр Тастак-2 — Толе Би",Алматы28 нояб.,"кирпичный дом, 1989 г.п., состояние: среднее, санузел раздельный, частично меблирована, Горячее предложение от АН Галерея Недвижимости! Развитая инфраструктура, тихий двор, просторная прихожая, комнаты изолированы. Звоните!"
"4-комнатная квартира, 123 м², 6/16 этажВсе заметкиУдалить",https://krisha.kz//a/show/53287421,65 000 000〒,"Алмалинский р-н, Наурызбай Батыра — Шевченко",Алматы28 нояб.,"жил. комплекс Шанырак, монолитный дом, 2010 г.п., состояние: евроремонт, санузел 2 с/у и более, пустая, Квартира пустая, в ней после ремонта никто не жил! Центр города, рядом имеется школа, торговые центры, детские сады. Окна в две стороны на восток и запад. Звоните!"
"4-комнатная квартира, 123 м², 6/16 этажВсе заметкиУдалить",https://krisha.kz//a/show/663375076,65 000 000〒,"Алмалинский р-н, Шевченко 88",Алматы28 нояб.,"жил. комплекс Шанырак, монолитный дом, 2015 г.п., состояние: евроремонт, санузел 2 с/у и более, Пластиковые окна, комнаты изолированы, кухня-студия, новая сантехника, счётчики, тихий двор. Квартира пустая, в ней после ремонта никто не жил! Центр города, рядом имеется школа, торговые центры, детские…"
"4-комнатная квартира, 80.9 м², 5/5 этажВсе заметкиУдалить",https://krisha.kz//a/show/663291806,30 000 000〒,"Алмалинский р-н, мкр Тастак-2, Мкр Тастак-2 — Тлендиева",Алматы28 нояб.,"кирпичный дом, 1989 г.п., состояние: среднее, санузел раздельный, частично меблирована, Пластиковые окна, встроенная кухня, тихий двор. Горячее предложение от АН Галерея Недвижимости! Развитая инфраструктура, тихий двор, просторная прихожая, комнаты изолированы. Звоните!"
"4-комнатная квартира, 130 м², 4/5 этажВсе заметкиУдалить",https://krisha.kz//a/show/663596725,59 000 000〒,"Алмалинский р-н, Мауленова — Курмангазы",Алматы28 нояб.,"кирпичный дом, 1991 г.п., состояние: евроремонт, санузел 2 с/у и более, частично меблирована, Предлагаю Вашему вниманию Эксклюзивную квартиру в золотом квадрате г. Алматы. (4 к улучшенная квартира в хорошем кирпичном доме). На площадке расположенны 2 квартиры. Площадь S=130, кухня - 12 м2, разде…"
"4-комнатная квартира, 90 м², 5/5 этажВсе заметкиУдалить",https://krisha.kz//a/show/663596715,36 500 000〒,"Алмалинский р-н, Толе би — Нурмакова",Алматы28 нояб.,"кирпичный дом, 1987 г.п., состояние: евроремонт, жил. площадь 60 кв.м., кухня 12 кв.м., санузел 2 с/у и более, телефон: отдельный, полностью меблирована, Продается 4х комнатная квартира в Алмалинском районе Южной Столицы. Очень удобное расположение развитая инфраструктура: учебные и дошкол…"
"4-комнатная квартира, 130 м², 4/5 этажВсе заметкиУдалить",https://krisha.kz//a/show/663596560,59 000 000〒,"Алмалинский р-н, Мауленова — Курмангазы",Алматы28 нояб.,"кирпичный дом, 1991 г.п., состояние: евроремонт, санузел 2 с/у и более, телефон: отдельный, частично меблирована, Предлагаю Вашему вниманию Эксклюзивную квартиру в золотом квадрате г. Алматы. (4 к улучшенная квартира в хорошем кирпичном доме). . Отличный этаж - 4 из 5. На площадке расположены 2…"
"4-комнатная квартира, 80 м², 5/5 этажВсе заметкиУдалить",https://krisha.kz//a/show/662524088,30 000 000〒,"Алмалинский р-н, Аносова 32 — Толе би",Алматы28 нояб.,"панельный дом, 1978 г.п., состояние: хорошее, жил. площадь 50.5 кв.м., кухня 11 кв.м., потолки 2.7м., санузел раздельный, телефон: есть возможность подключения, интернет оптика, частично меблирована, Просторная светлая квартира с хорошей энергетикой На площадке 2 Квартиры Уютная и тёплая Комн…"
"4-комнатная квартира, 108 м², 4/5 этажВсе заметкиУдалить",https://krisha.kz//a/show/663002664,60 000 000〒,"Алмалинский р-н, Кабанбай батыра 109 — Сейфулина",Алматы28 нояб.,"кирпичный дом, 1977 г.п., состояние: евроремонт, потолки 2.8м., санузел раздельный, телефон: отдельный, интернет оптика, частично меблирована, Агентство Недвижимости «Вариант Казахстан» предлагает Вашему вниманию на Продажу: Улучшенная 4- Комнатная Квартира в Шикарном районе - Алмалинский район…"
"4-комнатная квартира, 154 м², 5/7 этажВсе заметкиУдалить",https://krisha.kz//a/show/663454924,77 500 000〒,"Алмалинский р-н, Нурмакова 79 — Кабанбай Батыра",Алматы28 нояб.,"жил. комплекс Акмарал, кирпичный дом, 2007 г.п., состояние: хорошее, жил. площадь 116 кв.м., кухня 22 кв.м., потолки 2.8м., санузел раздельный, телефон: отдельный, интернет ADSL, полностью меблирована"
"4-комнатная квартира, 105 м², 4/9 этажВсе заметкиУдалить",https://krisha.kz//a/show/661090027,40 000 004〒,"Алмалинский р-н, улица Кожамкулова 117 — Жибек жолы",Алматы28 нояб.,"панельный дом, 1982 г.п., состояние: евроремонт, жил. площадь 68 кв.м., кухня 14 кв.м., потолки 2.9м., санузел раздельный, телефон: отдельный, интернет оптика, полностью меблирована, Развитая инфраструктура, хорошая транспортная развязка, все в шаговой доступности, показ бесплатно в любое вре…"
"4-комнатная квартира, 137 м²Все заметкиУдалить",https://krisha.kz//a/show/50696406,65 000 000〒,"Алмалинский р-н, улица Прокофьева 148",Алматы28 нояб.,"жил. комплекс Манхеттан (29 квартал), кирпичный дом, 2008 г.п., состояние: евроремонт, потолки 3м., санузел 2 с/у и более, телефон: отдельный, интернет оптика, частично меблирована, 4-х комнатная квартира с ремонтом сделанным для себя. В данном ЖК такой планировки не имеется. Планировка б…"
"4-комнатная квартира, 122.2 м², 10/13 этажВсе заметкиУдалить",https://krisha.kz//a/show/663308354,41 590 000〒,"Алмалинский р-н, Макатаева 131 1",Алматы28 нояб.,"жил. комплекс Atlant, монолитный дом, 2019 г.п., потолки 2.8м., Горячий вариант ! Самая низкая цена на рынке! Предчиствая отделка ! Хозяин"
"4-комнатная квартира, 140 м², 18/20 этажВсе заметкиУдалить",https://krisha.kz//a/show/58023716,100 000 000〒,"Алмалинский р-н, Шевченко 154 — Муканова",Алматы28 нояб.,"жил. комплекс Жастар Mag, монолитный дом, 2008 г.п., состояние: евроремонт, жил. площадь 160 кв.м., кухня 20 кв.м., потолки 3м., санузел 2 с/у и более, телефон: отдельный, интернет оптика, полностью меблирована"
"4-комнатная квартира, 74 м², 3/5 этажВсе заметкиУдалить",https://krisha.kz//a/show/54061591,30 500 000〒,"Алмалинский р-н, Желтоксан 36 — Ташкентской",Алматы28 нояб.,"1974 г.п., состояние: хорошее, жил. площадь 55 кв.м., кухня 9 кв.м., частично меблирована, Квартира тёплая, не угловая. Дома светло и уютно. Месторасположение очень удобное, все рядом, Мега Парк, Арбат, 2 Вокзал, склады аптек. 90 лицей, 74 школа, 54 лицей. Одним словом центр Алматы! Балкон новы…"
"4-комнатная квартира, 80 м², 5/5 этажВсе заметкиУдалить",https://krisha.kz//a/show/662325214,33 000 000〒,"Алмалинский р-н, мкр Тастак-3 43 — Розыбакиева",Алматы28 нояб.,"кирпичный дом, 1992 г.п., состояние: евроремонт, потолки 2.8м., санузел раздельный, телефон: есть возможность подключения, интернет ADSL, частично меблирована, Продам 4-х комнатную квартиру. Дом свежий, чистый, после ремонта. Приклеены новые, моющиеся обои. Тихий двор. торг имеется. По всем вопроса…"
"4-комнатная квартира, 113.3 м², 3/9 этажВсе заметкиУдалить",https://krisha.kz//a/show/58541756,56 650 000〒,"Алмалинский р-н, Шевченко 94 — Мауленова",Алматы28 нояб.,"жил. комплекс Nur-Ay Residence, монолитный дом, 2020 г.п., состояние: свободная планировка, потолки 3м., санузел совмещенный, телефон: отдельный, интернет ADSL, Представляем вашему вниманию новый жилой комплекс премиального класса > На против стадиона Динамо, по ул. Шевченко (ЗОЛОТОЙ КВАДР…"
"4-комнатная квартира, 137.9 м², 2/18 этажВсе заметкиУдалить",https://krisha.kz//a/show/663269260,61 600 000〒,"Алмалинский р-н, Курмангазы 145 — 95",Алматы28 нояб.,"монолитный дом, 2006 г.п., жил. площадь 94.8 кв.м., кухня 16 кв.м., Имущество АО «Народный Банк Казахстана» Доступно льготное кредитование по программе ""Halyk Sale"" : для физ. лиц. - ставка вознаграждения – от 8%, с первоначальным взносом – от 20%, сроком до 20 лет Для получения подробн…"
"4-комнатная квартира, 85 м², 4/5 этажВсе заметкиУдалить",https://krisha.kz//a/show/663484489,26 200 000〒,"Алмалинский р-н, мкр Тастак-2, Мкр Тастак-2",Алматы28 нояб.,"кирпичный дом, 1989 г.п., состояние: хорошее, потолки 2.75м., санузел раздельный, частично меблирована, - Кирпичный дом - лучше сохраняет тепло, а в знойную жару встретит вас приятной прохладой. Кирпич так же имеет лучшую шумоизоляцию, вас не будут беспокоить ненужные шумы. выше срок службы…"
"4-комнатная квартира, 104 м², 6/13 этажВсе заметкиУдалить",https://krisha.kz//a/show/662835110,52 000 000〒,"Алмалинский р-н, Досмухамедова 79 — Карасай Батыра",Алматы28 нояб.,"жил. комплекс Double Star, монолитный дом, 2020 г.п., состояние: свободная планировка, потолки 3м., санузел совмещенный, телефон: отдельный, интернет ADSL, Добро пожаловать, в апартаменты бизнес-класса «Double Star»! Сити - комплекс «Double Star» приглашает Вас, в тихую гавань в центре городской ж…"
"4-комнатная квартира, 97.3 м², 17/22 этажВсе заметкиУдалить",https://krisha.kz//a/show/56362268,40 000 000〒,"Алмалинский р-н, Абая 223 — Тлендиева",Алматы28 нояб.,"жил. комплекс Жагалау - 46 квартал, монолитный дом, 2014 г.п., состояние: евроремонт, санузел 2 с/у и более, частично меблирована, Срочно ! Прекрасный понарамный вид из окна. Отличная продуваемость свежий воздух. Просторный двор с детской площадкой. Круглосуточная охрана Рядом находиться Метро, шко…"
"4-комнатная квартира, 139 м², 12/20 этажВсе заметкиУдалить",https://krisha.kz//a/show/663604304,55 000 000〒,"Алмалинский р-н, Брусиловского",Алматы28 нояб.,"жил. комплекс Манхеттан (29 квартал), монолитный дом, 2007 г.п., состояние: хорошее, санузел 2 с/у и более, частично меблирована, Пластиковые окна, комнаты изолированы, кухня-студия, встроенная кухня, новая сантехника, кладовка, счётчики, тихий двор, кондиционер, улучшенная. Квартира 140 квадра…"
