Заголовок,ссылка,Цена,Адрес,Дата,comment
"4-комнатная квартира, 94 м², 3/5 этажВсе заметкиУдалить",https://krisha.kz//a/show/663522907,43 000 000〒,"Алмалинский р-н, Розыбакиева — Курмангазы",Алматы27 нояб.,"кирпичный дом, 1989 г.п., состояние: евроремонт, потолки 2.8м., полностью меблирована, (№ BDQ-4 - 18897) Вашему вниманию Агентство Недвижимости ""Qubiq"" Предоставляет Вам шикарную квартиру практически в центре города! С прекрасно развитой инфраструктурой! В ведомственном кирпично-ригель…"
"4-комнатная квартира, 90 м², 4/5 этажВсе заметкиУдалить",https://krisha.kz//a/show/662002920,53 000 000〒,"Алмалинский р-н, Казыбек Би 78 — Наурызбай Батыра",Алматы27 нояб.,"кирпичный дом, 1980 г.п., состояние: хорошее, жил. площадь 58 кв.м., кухня 9 кв.м., санузел раздельный, телефон: отдельный, интернет через TV кабель, частично меблирована, Дом во дворах"
"4-комнатная квартира, 114 м², 1/3 этажВсе заметкиУдалить",https://krisha.kz//a/show/660932028,65 000 000〒,"Алмалинский р-н, Абая 51/53 — Чайковского",Алматы27 нояб.,"кирпичный дом, 1960 г.п., состояние: хорошее, санузел раздельный, телефон: отдельный, интернет через TV кабель, частично меблирована, Дом ЦК огорожен парковка"
"4-комнатная квартира, 220 м², 6/6 этажВсе заметкиУдалить",https://krisha.kz//a/show/29398122,280 000 000〒,"Алмалинский р-н, Чайковского 149 — Абая",Алматы27 нояб.,"жил. комплекс Базис на Чайковского, кирпичный дом, 2014 г.п., состояние: евроремонт, санузел 2 с/у и более, телефон: отдельный, интернет через TV кабель, частично меблирована, Клубный дом"
"4-комнатная квартира, 99 м², 2/5 этажВсе заметкиУдалить",https://krisha.kz//a/show/663589847,41 500 000〒,"Алмалинский р-н, Кожамкулова — Богенбай Батыра",Алматы27 нояб.,"кирпичный дом, 1988 г.п., состояние: требует ремонта, санузел раздельный, пустая"
"4-комнатная квартира, 130 м², 2/9 этажВсе заметкиУдалить",https://krisha.kz//a/show/662996329,79 000 000〒,"Алмалинский р-н, Гагарина 66б — Джамбула-Гагарина",Алматы27 нояб.,"монолитный дом, 2015 г.п., состояние: евроремонт, жил. площадь 80 кв.м., кухня 20 кв.м., потолки 3м., санузел раздельный, интернет ADSL, полностью меблирована"
"4-комнатная квартира, 76 м², 3/12 этажВсе заметкиУдалить",https://krisha.kz//a/show/663589608,32 400 000〒,"Алмалинский р-н, Розыбакиева — Толе Би",Алматы27 нояб.,"панельный дом, 1988 г.п., Отличная четырехкомнатная квартира с изолированными комнатами в тихом дворе"
"4-комнатная квартира, 150 м², 13/19 этажВсе заметкиУдалить",https://krisha.kz//a/show/57735927,82 000 000〒,"Алмалинский р-н, Шевченко 154",Алматы27 нояб.,"жил. комплекс Жастар-2 Mag, монолитный дом, 2007 г.п., состояние: евроремонт, жил. площадь 100 кв.м., кухня 20 кв.м., потолки 3м., санузел 2 с/у и более, интернет оптика, частично меблирована, Хозяин квартиры продам, в отличном состоянии, авторский дизайн. Рассмотрю варианты обмена квартир, в ра…"
"4-комнатная квартира, 94 м², 3/5 этажВсе заметкиУдалить",https://krisha.kz//a/show/663586509,43 000 000〒,"Алмалинский р-н, Розыбакиева — Курмангазы",Алматы27 нояб.,"кирпичный дом, 1989 г.п., состояние: евроремонт, потолки 2.8м., полностью меблирована, (№ BDQ-4 - 18897) Вашему вниманию Агентство Недвижимости ""Qubiq"" Предоставляет Вам шикарную квартиру практически в центре города! С прекрасно развитой инфраструктурой! В ведомственном кирпично-ригель…"
"4-комнатная квартира, 140 м², 12/20 этажВсе заметкиУдалить",https://krisha.kz//a/show/663586559,53 000 000〒,"Алмалинский р-н, Брусиловского (Руднева) — Кулымбетова",Алматы27 нояб.,"жил. комплекс Манхеттан (29 квартал), монолитный дом, 2007 г.п., состояние: евроремонт, (№ BDQ-4 - 17607) Очень выгодное предложение от А. Г. Кубик! Друзья это действительно самая выгодная цены за кв. М. В данном Ж. К. Манхеттан, еще надо обратить внимание что состояние заезжай и живи смело…"
"4-комнатная квартира, 90 м², 3/3 этажВсе заметкиУдалить",https://krisha.kz//a/show/662695425,40 000 000〒,"Алмалинский р-н, Желтоксан — Гоголя",Алматы27 нояб.,"кирпичный дом, 1957 г.п., состояние: евроремонт, жил. площадь 65 кв.м., потолки 2.8м., санузел совмещенный, телефон: есть возможность подключения, интернет ADSL, полностью меблирована, 4-х комнатная квартира, в хорошем состоянии. Пересечение Гоголя/Желтоксан. Полный пакет документов, полност…"
"4-комнатная квартира, 74 м², 4/5 этажВсе заметкиУдалить",https://krisha.kz//a/show/663586692,29 000 000〒,"Алмалинский р-н, Казыбек би 189 — Нурмакова",Алматы27 нояб.,"панельный дом, 1968 г.п., состояние: хорошее, жил. площадь 54 кв.м., кухня 9 кв.м., санузел раздельный, частично меблирована, Предлагаем Вашему вниманию Эксклюзивное предложение от Агентства Недвижимости ""MAGNAT ESTATE"". Хорошее месторасположение почти в центре города. Спальный район. Так…"
"4-комнатная квартира, 109 м², 2/5 этажВсе заметкиУдалить",https://krisha.kz//a/show/663586519,52 900 000〒,"Алмалинский р-н, Муратбаева — Айтеке би",Алматы27 нояб.,"кирпичный дом, 1971 г.п., состояние: евроремонт, жил. площадь 105 кв.м., кухня 10 кв.м., потолки 2.75м., санузел 2 с/у и более, телефон: отдельный, интернет ADSL, частично меблирована, (№ BDQ-2 - 18703) Невероятно выгодное предложение ! Успейте купить квартиру по выгодной цене. Просторная и уютн…"
"4-комнатная квартира, 78 м², 1/9 этажВсе заметкиУдалить",https://krisha.kz//a/show/663586219,24 900 000〒,"Алмалинский р-н, Толе Би",Алматы27 нояб.,"монолитный дом, 1991 г.п., состояние: хорошее, жил. площадь 45 кв.м., кухня 8 кв.м., потолки 2.8м., санузел 2 с/у и более, телефон: есть возможность подключения, интернет ADSL, частично меблирована, Агентство недвижимости ""Qubiq"" предлагает Вам эксклюзивный вариант! 4 изолированные ком…"
"4-комнатная квартира, 105 м², 6/16 этажВсе заметкиУдалить",https://krisha.kz//a/show/663586190,55 000 000〒,"Алмалинский р-н, Шевченко 88",Алматы27 нояб.,"жил. комплекс Шанырак, монолитный дом, 2016 г.п., состояние: евроремонт, санузел совмещенный, телефон: отдельный, частично меблирована, Отличный вариант! Развитая социально-транспортная инфраструктура, рядом расположены следующие объекты: магазины, салоны красоты, аптеки и т.д"
"4-комнатная квартира, 78 м², 1/9 этажВсе заметкиУдалить",https://krisha.kz//a/show/663585971,24 900 000〒,"Алмалинский р-н, Толе Би",Алматы27 нояб.,"монолитный дом, 1991 г.п., состояние: хорошее, жил. площадь 45 кв.м., кухня 8 кв.м., потолки 2.8м., санузел 2 с/у и более, телефон: есть возможность подключения, интернет ADSL, частично меблирована, Агентство недвижимости ""Qubiq"" предлагает Вам эксклюзивный вариант! 4 изолированные ком…"
"4-комнатная квартира, 110 м², 4/4 этажВсе заметкиУдалить",https://krisha.kz//a/show/662835020,41 000 000〒,"Алмалинский р-н, Толе Би",Алматы27 нояб.,"кирпичный дом, 1940 г.п., состояние: евроремонт, жил. площадь 75 кв.м., кухня 11 кв.м., потолки 3м., санузел 2 с/у и более, телефон: отдельный, интернет оптика, полностью меблирована, 9209-1.ВНИМАНИЕ. Продается шикарная четырехкомнатная квартира. Пластиковые окна, улучшенная, комнаты изолиров…"
"4-комнатная квартира, 78 м², 1/9 этажВсе заметкиУдалить",https://krisha.kz//a/show/663585193,24 900 000〒,"Алмалинский р-н, Толе Би",Алматы27 нояб.,"монолитный дом, 1991 г.п., состояние: хорошее, жил. площадь 45 кв.м., кухня 8 кв.м., потолки 2.8м., санузел 2 с/у и более, телефон: есть возможность подключения, интернет ADSL, частично меблирована, Агентство недвижимости ""Qubiq"" предлагает Вам эксклюзивный вариант! 4 изолированные ком…"
"4-комнатная квартира, 95 м², 8/9 этажВсе заметкиУдалить",https://krisha.kz//a/show/663584947,40 500 000〒,"Алмалинский р-н, Аносова",Алматы27 нояб.,"панельный дом, 1991 г.п., состояние: евроремонт, санузел раздельный, частично меблирована, Чистая ютная тёплая светлая квартира. Встроенный большой гардероб. Комнаты большие. Окна север-юг. Новый лифт 2020 Детская спортивная площадка новые 2020 года. Тихий двор. Из мебели остаётся кухня, дорогая. т…"
"4-комнатная квартира, 73.3 м², 5/5 этажВсе заметкиУдалить",https://krisha.kz//a/show/661922995,23 207 000〒,"Алмалинский р-н, Тургута Озала 61",Алматы27 нояб.,"В залоге, панельный дом, 1979 г.п., жил. площадь 50.3 кв.м., кухня 7.3 кв.м., санузел раздельный, 4-х комнатная квартира, этаж 5/5, общей площадью-73.3 кв. м., жилой - 50.3 кв. м., кухня–7.3 кв. м., тип крыши – плоская. Имущество одится в залоге АО ""Kaspi Bank"". Реализация залого…"
"4-комнатная квартира, 114 м², 1/3 этажВсе заметкиУдалить",https://krisha.kz//a/show/663117403,65 000 000〒,"Алмалинский р-н, Абая 51/53 — Чайковского",Алматы27 нояб.,"кирпичный дом, 1961 г.п., состояние: евроремонт, жил. площадь 65 кв.м., кухня 13 кв.м., потолки 3.7м., санузел раздельный, телефон: отдельный, интернет через TV кабель, частично меблирована, Золотой квадрат тихий огороженный дом ЦК, дом учённых и писателей, рядом всё необходимое для комфортног…"
"4-комнатная квартира, 73 м², 4/5 этажВсе заметкиУдалить",https://krisha.kz//a/show/663583359,31 500 000〒,"Алмалинский р-н, Казбек би — Нурмакова",Алматы27 нояб.,"панельный дом, 1968 г.п., состояние: хорошее, жил. площадь 53 кв.м., кухня 9 кв.м., санузел совмещенный, Предлагаем Вашему вниманию Эксклюзивное предложение от Агентства Недвижимости ""MAGNAT ESTATE"". Хорошее месторасположение почти в центре города. Спальный район. Так же в шаго…"
"4-комнатная квартира, 88 м², 4/6 этажВсе заметкиУдалить",https://krisha.kz//a/show/53837371,44 000 000〒,"Алмалинский р-н, Абылай хана 74 — Гоголя",Алматы27 нояб.,"1968 г.п., состояние: среднее, жил. площадь 64 кв.м., кухня 9 кв.м., потолки 2.8м., санузел раздельный, телефон: есть возможность подключения, Квартира находится в Золотом квадрате, над супермаркетом Юбилейный и маг Меломан. Рядом метро (ст. Жибек жолы), центральная аптека #2, ЦУМ, Арбат, пешех…"
"4-комнатная квартира, 75 м², 4/5 этажВсе заметкиУдалить",https://krisha.kz//a/show/663582799,32 000 000〒,"Алмалинский р-н, Богенбай Батыра (Кирова) — Исаева",Алматы27 нояб.,"кирпичный дом, 1979 г.п., состояние: среднее, санузел раздельный, частично меблирована, Продается 4 -х комнатная квартира улучшенной планировки. Состояние хорошее, новая сантехника, кладовка. Этаж средний, дом кирпичный. Два балкона застекленных. Тихий двор, хорошие соседи. Удобная транспортн…"
"4-комнатная квартира, 100 м², 7/9 этажВсе заметкиУдалить",https://krisha.kz//a/show/663022716,42 500 000〒,"Алмалинский р-н, Толе би 192 — Айманова",Алматы27 нояб.,"монолитный дом, 1986 г.п., состояние: хорошее, жил. площадь 58 кв.м., кухня 19 кв.м., потолки 2.8м., санузел совмещенный, телефон: отдельный, интернет ADSL, частично меблирована, На площадке две квартиры, не угловая, в шаговой доступности многопрофильная гимназия 79, парк ганди, великолепный вид н…"
"4-комнатная квартира, 94 м², 3/5 этажВсе заметкиУдалить",https://krisha.kz//a/show/663582037,43 000 000〒,"Алмалинский р-н, Розыбакиева — Курмангазы",Алматы27 нояб.,"кирпичный дом, 1989 г.п., состояние: евроремонт, потолки 2.8м., полностью меблирована, (№ BDQ-5 - 18897) Вашему вниманию Агентство Недвижимости ""Qubiq"" Предоставляет Вам шикарную квартиру практически в центре города! С прекрасно развитой инфраструктурой! В ведомственном кирпично-ригель…"
"4-комнатная квартира, 64 м², 1/5 этажВсе заметкиУдалить",https://krisha.kz//a/show/663582081,24 000 000〒,"Алмалинский р-н, Макатаева 156 — Масанчи",Алматы27 нояб.,"панельный дом, 1973 г.п., состояние: хорошее, жил. площадь 40 кв.м., кухня 8.4 кв.м., санузел совмещенный, телефон: отдельный, интернет ADSL, частично меблирована, Отличное предложение от агентства недвижимости Метры. В данном районе отличные перспективы на будущее с очень развитой инфраструктуро…"
"4-комнатная квартира, 72 м², 5/5 этажВсе заметкиУдалить",https://krisha.kz//a/show/58181529,32 000 000〒,"Алмалинский р-н, Маметовой 29/41",Алматы27 нояб.,"кирпичный дом, 1976 г.п., состояние: евроремонт, санузел раздельный, интернет через TV кабель, полностью меблирована"
"4-комнатная квартира, 79 м², 2/5 этажВсе заметкиУдалить",https://krisha.kz//a/show/663580394,36 500 000〒,"Алмалинский р-н, Муратбаева — Айтеке би (Октябрьская)",Алматы27 нояб.,"панельный дом, 1975 г.п., состояние: хорошее, санузел раздельный, частично меблирована, Продается уютная, теплая, светлая, просторная 4-х комнатная квартира в отличном тихом районе. Оснащена системой умного дома smart home mi. Умный свет, датчики движения, датчики утечки воды, видеонаблюдение, роб…"
"4-комнатная квартира, 67.2 м², 2/4 этажВсе заметкиУдалить",https://krisha.kz//a/show/662457227,32 000 000〒,"Алмалинский р-н, Ауэзова 8 — Гоголя",Алматы27 нояб.,"кирпичный дом, 1974 г.п., состояние: хорошее, жил. площадь 45.4 кв.м., потолки 2.7м., санузел раздельный, Срочно, торг"
"4-комнатная квартира, 94 м², 3/5 этажВсе заметкиУдалить",https://krisha.kz//a/show/663580625,42 999 000〒,"Алмалинский р-н, Розыбакиева — Курмангазы",Алматы27 нояб.,"кирпичный дом, 1989 г.п., состояние: евроремонт, потолки 2.8м., полностью меблирована, (№ BDQ-7 - 18897) Вашему вниманию Агентство Недвижимости ""Qubiq"" Предоставляет Вам шикарную квартиру практически в центре города! С прекрасно развитой инфраструктурой! В ведомственном кирпично-ригель…"
"4-комнатная квартира, 90 м², 13/13 этажВсе заметкиУдалить",https://krisha.kz//a/show/662641674,44 800 000〒,"Алмалинский р-н, Варламова",Алматы27 нояб.,"монолитный дом, 2010 г.п., санузел совмещенный, Уважаемые гости южной столицы и жителигорода Алматы! Представляю вашему вниманию, Жилой комплекс расположен в Алмалинском районе в квадрате улиц: Есенжанова – Тлендиева– Варламова – Малая Абая Благодаря своему месторасположению, практически из всех кв…"
"4-комнатная квартира, 139 м², 12/20 этажВсе заметкиУдалить",https://krisha.kz//a/show/663580653,55 000 000〒,"Алмалинский р-н, Брусиловского 144",Алматы27 нояб.,"жил. комплекс Манхеттан (29 квартал), монолитный дом, 2007 г.п., состояние: евроремонт, санузел 2 с/у и более, частично меблирована, Пластиковые окна, комнаты изолированы, кухня-студия, встроенная кухня, новая сантехника, кладовка, счётчики, тихий двор, кондиционер, улучшенная. Квартира 140 квадра…"
"4-комнатная квартира, 73 м², 4/5 этажВсе заметкиУдалить",https://krisha.kz//a/show/663580602,31 500 000〒,"Алмалинский р-н, Казбек би — Нурмакова",Алматы27 нояб.,"панельный дом, 1968 г.п., состояние: хорошее, жил. площадь 53 кв.м., кухня 9 кв.м., санузел совмещенный, Предлагаем Вашему вниманию Эксклюзивное предложение от Агентства Недвижимости ""MAGNAT ESTATE"". Хорошее месторасположение почти в центре города. Спальный район. Так же в шаго…"
"4-комнатная квартира, 80 м², 5/5 этажВсе заметкиУдалить",https://krisha.kz//a/show/663580316,33 400 000〒,"Алмалинский р-н, Нурмакова — Богенбай Батыра (Кирова)",Алматы27 нояб.,"кирпичный дом, 1978 г.п., состояние: евроремонт, жил. площадь 55 кв.м., кухня 11 кв.м., потолки 2.37м., санузел раздельный, частично меблирована, Срочно продается 4-х комнатная квартира, улучшенной планировки в одном из самых востребованных районов г. Алматы. Комнаты изолированные, квартира теп…"
"4-комнатная квартира, 137 м², 5/22 этажВсе заметкиУдалить",https://krisha.kz//a/show/663087570,110 000 000〒,"Алмалинский р-н, Кабанбай батыра — Абылай Хана (Коммунистическая)",Алматы27 нояб.,"жил. комплекс Столичный Центр, монолитный дом, 2005 г.п., состояние: хорошее, жил. площадь 89.4 кв.м., кухня 16.4 кв.м., потолки 3м., санузел 2 с/у и более, полностью меблирована, Пластиковые окна, комнаты изолированы, кухня-студия, встроенная кухня, новая сантехника, кладовка, счётчики, тихий дв…"
