Заголовок,ссылка,Цена,Адрес,Дата,comment
"2-комнатная квартира, 42.2 м², 4/4 этажВсе заметкиУдалить",https://krisha.kz//a/show/663484735,22 000 000〒,"Бостандыкский р-н, Шашкина — Аль-Фараби",Алматы29 нояб.,"панельный дом, 1972 г.п., состояние: евроремонт, потолки 2.6м., санузел совмещенный, частично меблирована, (№ BDQ-5 - 18763) Продается отличная квартира в экологически чистом районе нашего города. В квартире был сделан евроремонт, новая сантехника, тихий двор. Проблем с крышей не имеется. По вс…"
"2-комнатная квартира, 72 м², 11/12 этажВсе заметкиУдалить",https://krisha.kz//a/show/663289649,35 500 000〒,"Бостандыкский р-н, Егизбаева Косая (Линия 21-я) — Сатпаева",Алматы29 нояб.,"жил. комплекс Асыл Тау, монолитный дом, 2016 г.п., состояние: евроремонт, санузел 2 с/у и более, Продаётся 2-комнатная в ЖК Асыл Тау. Квартира улучшенной планировки в самом ликвидном районе города Алматы. Квартира в отличном состоянии. Не требует никаких вложений! Развитая инфраструктура, не углова…"
"2-комнатная квартира, 42 м², 11/12 этажВсе заметкиУдалить",https://krisha.kz//a/show/662494492,36 900 000〒,"Бостандыкский р-н, Гагарина 311 — Ескараева",Алматы29 нояб.,"жил. комплекс Gagarin Park, монолитный дом, 2018 г.п., состояние: евроремонт, потолки 3м., полностью меблирована"
"2-комнатная квартира, 51.1 м², 2/4 этажВсе заметкиУдалить",https://krisha.kz//a/show/663474072,24 300 000〒,"Бостандыкский р-н, мкр Коктем-2, Мкр Коктем-2 — Тимирязева",Алматы29 нояб.,"панельный дом, 1972 г.п., состояние: хорошее, жил. площадь 34.8 кв.м., кухня 6 кв.м., санузел совмещенный, В продаже 2-комнатная квартира в отличном состоянии. Улучшенная планировка. Престижный, развитый район. Рядом школы, детсады, продуктовые магазины, автобусные остановки, КазНУ имени Аль-Фараби…"
"2-комнатная квартира, 78.3 м², 3/8 этажВсе заметкиУдалить",https://krisha.kz//a/show/662307584,49 000 000〒,"Бостандыкский р-н, Розыбакиева — Ескараева",Алматы29 нояб.,"жил. комплекс 4YOU, 2020 г.п., потолки 3м., Бизнес класс Первая очередь Блок #2 с террасой на крыше Все окна на юг Не угловая"
"2-комнатная квартира, 56 м², 6/13 этажВсе заметкиУдалить",https://krisha.kz//a/show/663481249,41 000 000〒,"Бостандыкский р-н, Ходжанова 77/5",Алматы29 нояб.,"монолитный дом, 2020 г.п., состояние: евроремонт, жил. площадь 10 кв.м., потолки 3м., санузел совмещенный, телефон: есть возможность подключения, полностью меблирована, Внимание! Продается новая двухкомнатная квартира в элитном районе города. В квартире две недели назад был закончен ремонт. Да…"
"2-комнатная квартира, 33 м², 5/6 этажВсе заметкиУдалить",https://krisha.kz//a/show/663569555,15 900 000〒,"Бостандыкский р-н, Кенесары Хана 83/6 — Аскарова",Алматы29 нояб.,"В залоге, жил. комплекс Аскар Тау, монолитный дом, 2013 г.п., состояние: евроремонт, потолки 2.7м., санузел совмещенный, телефон: есть возможность подключения, интернет оптика, частично меблирована, Без комиссии! Квартира под ипотекой в Жилстрой банке. Снятие с залога от 5-7 дней. Жилой ком…"
"2-комнатная квартира, 51.1 м², 5/5 этажВсе заметкиУдалить",https://krisha.kz//a/show/663121443,20 500 000〒,"Бостандыкский р-н, Радостовца 170",Алматы29 нояб.,"кирпичный дом, 1979 г.п., состояние: требует ремонта, жил. площадь 30.5 кв.м., кухня 10.2 кв.м., санузел раздельный, Продается 2комн. квартира (общая 51, 1). Документы в порядке (к ипотеке готова). Зал - 17, 3; спальня -13, 2; кухня -10, 2. Большая кухня с балконом. Дом кирпичный. Этаж 5 из 5. Кро…"
"2-комнатная квартира, 54.2 м², 1/5 этажВсе заметкиУдалить",https://krisha.kz//a/show/662755647,24 500 000〒,"Бостандыкский р-н, Сатпаева 76 — Розыбакиева",Алматы29 нояб.,"панельный дом, 1983 г.п., состояние: евроремонт, жил. площадь 30.2 кв.м., кухня 10.2 кв.м., потолки 2.8м., санузел совмещенный, телефон: отдельный, интернет ADSL, частично меблирована, Продам без посредников, тёплую, светлую, ухоженную квартиру улучшенной планировки, в доме, построенном в 1983 г…"
"2-комнатная квартира, 52 м², 3/5 этажВсе заметкиУдалить",https://krisha.kz//a/show/662905456,25 500 000〒,"Бостандыкский р-н, Зейна Шашкина 9 — проспект Аль-Фараби",Алматы29 нояб.,"панельный дом, 1985 г.п., состояние: хорошее, жил. площадь 30 кв.м., кухня 10 кв.м., санузел раздельный, телефон: отдельный, интернет ADSL, полностью меблирована, Срочная продажа! Горячий вариант! Цена ниже рыночной! С документами проблем нет, свежий тех план без перепланировок, готова к ипотек…"
"2-комнатная квартира, 50 м², 3/5 этажВсе заметкиУдалить",https://krisha.kz//a/show/663503064,26 900 000〒,"Бостандыкский р-н, Шашкина — Попова",Алматы29 нояб.,"панельный дом, 1986 г.п., состояние: хорошее, санузел совмещенный, телефон: отдельный, интернет оптика, частично меблирована, Срочно продам в связи с переездом, торг при осмотре, средний этаж, дом сейсмоустойчивый, квартира тёплая, хорошие соседи, все рядом в шаговой доступности парки, Есентай мол…"
"2-комнатная квартира, 46 м², 2/5 этажВсе заметкиУдалить",https://krisha.kz//a/show/663573587,20 500 000〒,"Бостандыкский р-н, Радостовца — Мынбаева",Алматы29 нояб.,"кирпичный дом, 1975 г.п., состояние: хорошее, потолки 2.8м., санузел совмещенный, телефон: отдельный, интернет ADSL, частично меблирована, Представляем вашему вниманию очень хорошую квартиру по очень хорошей цене расположенной в центре города Алматы. Квартира тёплая, уютная, в хорошем состоянии…"
"2-комнатная квартира, 95 м², 12/15 этажВсе заметкиУдалить",https://krisha.kz//a/show/663313893,53 000 000〒,"Бостандыкский р-н, мкр Керемет 7",Алматы29 нояб.,"кирпичный дом, 2009 г.п., состояние: евроремонт, жил. площадь 75 кв.м., кухня 20 кв.м., потолки 3м., санузел 2 с/у и более, телефон: отдельный, интернет через TV кабель, полностью меблирована, Светлая и уютная двухкомнатная квартира на длительный срок от собственников. Внутри есть все для комфортно…"
"2-комнатная квартира, 69 м², 10/16 этажВсе заметкиУдалить",https://krisha.kz//a/show/663259118,33 000 000〒,"Бостандыкский р-н, Навои 7 — Жандосова",Алматы29 нояб.,"жил. комплекс Науаи, монолитный дом, 2008 г.п., состояние: евроремонт, потолки 2.8м., санузел совмещенный, телефон: есть возможность подключения, интернет ADSL, полностью меблирована, 🔴 Внимание! Представляем к вашему вниманию ""Новое предложение"" от агентства недвижимости МЕТРЫ. ✅Продае…"
"2-комнатная квартира, 93 м², 15/17 этажВсе заметкиУдалить",https://krisha.kz//a/show/663171235,38 500 000〒,"Бостандыкский р-н, Розыбакиева 289 — проспект Аль-Фараби",Алматы29 нояб.,"жил. комплекс Айгерим, монолитный дом, 2012 г.п., состояние: хорошее, потолки 2.9м., санузел раздельный, телефон: есть возможность подключения, интернет ADSL, пустая, 🟢2-х комнатная квартира на 15м этаже. площадь 93 кв. м в элитном районе города. 🔵Развитая инфраструктура. В шаговой доступности: Me…"
"2-комнатная квартира, 42.2 м², 1/5 этажВсе заметкиУдалить",https://krisha.kz//a/show/663544048,20 000 000〒,"Бостандыкский р-н, мкр Орбита-3 25",Алматы29 нояб.,"1976 г.п., состояние: хорошее, санузел раздельный, полностью меблирована, Продаём 2-х комн квартиру, отличное расположение, рядом садики и школы. В шаговой доступности мечеть, базарчик и magnum. Большой двор с отрестоврированной площадкой. Дом находится во дворах и исключает ненужным шум от дорог…"
"2-комнатная квартира, 142 м², 2/6 этажВсе заметкиУдалить",https://krisha.kz//a/show/56128928,83 780 000〒,"Бостандыкский р-н, мкр Мирас, Мкр «Мирас» 31 — Аскарова Асанбая",Алматы29 нояб.,"жил. комплекс Miras Park, монолитный дом, 2016 г.п., состояние: черновая отделка, потолки 3.2м., Премиальный жилой комплекс Miras Park- прямые продажи от Отдела продаж. ❗рассрочка от компании, без подтверждения доходов и банковского вмешательства. С ПВ от 30% (18 мес) ❗Аренда с последующим выкупом…"
"2-комнатная квартира, 130 м², 4/6 этажВсе заметкиУдалить",https://krisha.kz//a/show/56187441,77 409 500〒,"Бостандыкский р-н, мкр Мирас, Мкр «Мирас» 31блок7 — Аскарова",Алматы29 нояб.,"жил. комплекс Miras Park, монолитный дом, 2016 г.п., состояние: черновая отделка, потолки 3.2м., Премиальный жилой комплекс Miras Park- прямые продажи от Отдела продаж. ❗рассрочка от компании, без подтверждения доходов и банковского вмешательства. С ПВ от 30% (18 мес) ❗Аренда с последующим выкупом…"
"2-комнатная квартира, 83.5 м², 6/21 этажВсе заметкиУдалить",https://krisha.kz//a/show/49031693,116 900 000〒,"Бостандыкский р-н, проспект Аль-Фараби 77/3",Алматы29 нояб.,"жил. комплекс Esentai Apartments, монолитный дом, 2015 г.п., состояние: евроремонт, потолки 2.8м., санузел 2 с/у и более, телефон: есть возможность подключения, частично меблирована, Esentai Apartments - уникальный жилой комплекс в Алматы. Комплекс является частью одного из самых амбициозных п…"
"2-комнатная квартира, 52.6 м²Все заметкиУдалить",https://krisha.kz//a/show/55046307,от 23 670 000〒,"Бостандыкский р-н, Торайгырова — МустафинаИпотекаИпотекаКвартиры, которые можноприобрести в ипотекуот банков и по гос.программам",Алматы28 нояб.,"жил. комплекс Sholpan City, 12 этажей, 2020 г.п., жил. площадь 26.4 кв.м., кухня 6 кв.м., потолки 2.9м., санузел совмещенный, Преимущества: Высокая сейсмостойкость2-х ярусный паркингКруглосуточная охрана и видеонаблюдениеФитнес-це…"
"2-комнатная квартира, 64 м², 2/3 этажВсе заметкиУдалить",https://krisha.kz//a/show/663608278,32 000 000〒,"Бостандыкский р-н, Аскарова 21/68",Алматы28 нояб.,"жил. комплекс КД EVIM, монолитный дом, 2020 г.п., состояние: свободная планировка, потолки 5.5м., санузел 2 с/у и более, Без комиссии! Двухуровневая квартира в новом клубном доме EViM. Комплекс состоит из двух домов, в каждом по 9 квартир. Квартира в предчистовой отделке, дизайн проект в пода…"
"2-комнатная квартира, 43.2 м², 1/5 этажВсе заметкиУдалить",https://krisha.kz//a/show/663594726,18 800 000〒,"Бостандыкский р-н, Утепова — Гагарина",Алматы28 нояб.,"монолитный дом, 1975 г.п., состояние: хорошее, жил. площадь 27.3 кв.м., кухня 6.1 кв.м., полностью меблирована, Очень развитая инфраструктура. Хорошая транспортная развязка. Рядом Атакент, Мега, Магнум, Поликлиника 17, школа гимназия 73, детские сады. Юридически чистая квартира. Полност…"
"2-комнатная квартира, 53.67 м²Все заметкиУдалить",https://krisha.kz//a/show/55046186,от 24 133 500〒,"Бостандыкский р-н, Торайгырова — МустафинаИпотекаИпотекаКвартиры, которые можноприобрести в ипотекуот банков и по гос.программам",Алматы28 нояб.,"жил. комплекс Sholpan City, 12 этажей, 2020 г.п., жил. площадь 26.5 кв.м., кухня 6 кв.м., потолки 2.9м., санузел совмещенный, Преимущества: Высокая сейсмостойкость2-х ярусный паркингКруглосуточная охрана и видеонаблюдениеФитнес-це…"
"2-комнатная квартира, 48 м², 4/5 этажВсе заметкиУдалить",https://krisha.kz//a/show/663320577,20 800 000〒,"Бостандыкский р-н, Брусиловского (Руднева) — Сатпаева",Алматы28 нояб.,"панельный дом, 1977 г.п., состояние: хорошее, жил. площадь 33 кв.м., кухня 6 кв.м., санузел совмещенный, Пластиковые окна, неугловая, комнаты изолированы, встроенная кухня, новая сантехника, кладовка, счётчики, тихий двор, кондиционер"
"2-комнатная квартира, 62 м², 19/19 этажВсе заметкиУдалить",https://krisha.kz//a/show/663450812,26 900 000〒,"Бостандыкский р-н, Розыбакиева 289/2",Алматы29 нояб.,"жил. комплекс Айгерим, монолитный дом, 2012 г.п., состояние: евроремонт, жил. площадь 34 кв.м., кухня 7 кв.м., потолки 2.75м., санузел совмещенный, телефон: есть возможность подключения, полностью меблирована, 2- комнатная квартира в жк Айгерим продается с мебелью и техникой! Благоустроенн…"
"2-комнатная квартира, 61.6 м²Все заметкиУдалить",https://krisha.kz//a/show/55046139,от 26 414 080〒,"Бостандыкский р-н, Торайгырова — МустафинаИпотекаИпотекаКвартиры, которые можноприобрести в ипотекуот банков и по гос.программам",Алматы28 нояб.,"жил. комплекс Sholpan City, 12 этажей, 2020 г.п., жил. площадь 31.8 кв.м., кухня 6 кв.м., потолки 2.9м., санузел 2 с/у и более, Преимущества: Высокая сейсмостойкость2-х ярусный паркингКруглосуточная охрана и видеонаблюдениеФитнес-це…"
"2-комнатная квартира, 61.5 м², 5/16 этажВсе заметкиУдалить",https://krisha.kz//a/show/662805981,26 000 000〒,"Бостандыкский р-н, Гагарина проспект — Абая",Алматы28 нояб.,"жил. комплекс Дом на Абая, монолитный дом, 2018 г.п., состояние: черновая отделка, санузел совмещенный, Представляем вашему вниманию ЖК Дом на Абая. Застройщик Рамс. Охраняемая территория, надземный и подземный паркинг, 2-лифта, хорошая детская площадка, межкомнатные стены из газоблока"
"2-комнатная квартира, 42.5 м², 4/4 этажВсе заметкиУдалить",https://krisha.kz//a/show/663158023,16 800 000〒,"Бостандыкский р-н, мкр Алмагуль 23 — Утепова",Алматы28 нояб.,"панельный дом, 1962 г.п., состояние: требует ремонта, жил. площадь 31 кв.м., кухня 6 кв.м., потолки 2.6м., санузел совмещенный, телефон: нет, интернет проводной, частично меблирована, Продам квартиру. Окна на Юг. Тёплая, светлая квартира. Рядом Мега, Магнум, Атакент. Под окном остановка. Через два…"
"2-комнатная квартира, 65.9 м²Все заметкиУдалить",https://krisha.kz//a/show/55046089,от 28 257 920〒,"Бостандыкский р-н, Торайгырова — МустафинаИпотекаИпотекаКвартиры, которые можноприобрести в ипотекуот банков и по гос.программам",Алматы28 нояб.,"жил. комплекс Sholpan City, 12 этажей, 2020 г.п., жил. площадь 31.3 кв.м., кухня 6 кв.м., потолки 2.9м., санузел 2 с/у и более, Преимущества: Высокая сейсмостойкость2-х ярусный паркингКруглосуточная охрана и видеонаблюдениеФитнес-це…"
"2-комнатная квартира, 52 м², 8/16 этажВсе заметкиУдалить",https://krisha.kz//a/show/663156062,32 000 000〒,"Бостандыкский р-н, Навои 208",Алматы28 нояб.,"жил. комплекс Шахристан, монолитный дом, 2015 г.п., состояние: среднее, потолки 2.9м., санузел совмещенный, полностью меблирована, Продам полноценную 2 комн квартиру, комнаты все раздельные. По переуступке под 11%. Ежемесячно 240000, 7 лет. О программе узнавайте, пожалуйста, в интернете (мне звон…"
"2-комнатная квартира, 68.2 м²Все заметкиУдалить",https://krisha.kz//a/show/55046246,от 29 244 160〒,"Бостандыкский р-н, Торайгырова — МустафинаИпотекаИпотекаКвартиры, которые можноприобрести в ипотекуот банков и по гос.программам",Алматы28 нояб.,"жил. комплекс Sholpan City, 12 этажей, 2020 г.п., жил. площадь 38.3 кв.м., кухня 6 кв.м., потолки 2.9м., санузел 2 с/у и более, Преимущества: Высокая сейсмостойкость2-х ярусный паркингКруглосуточная охрана и видеонаблюдениеФитнес-це…"
"2-комнатная квартира, 54 м², 3/9 этажВсе заметкиУдалить",https://krisha.kz//a/show/663391194,25 500 000〒,"Бостандыкский р-н, Айманова 149 — Жандосова",Алматы29 нояб.,"1986 г.п., жил. площадь 30 кв.м., кухня 9 кв.м., Кухня 9, отличное расположение, 2 лоджии, потолки 290, окна север- юг, во дворах за Дарханом, окна вообще не выходят на проезжую часть, без перепланировок, с/ узел раздельный, комнаты изолированные, двор с детскими площадками, очень теплая свет…"
"2-комнатная квартира, 65 м², 11/17 этажВсе заметкиУдалить",https://krisha.kz//a/show/663494951,36 500 000〒,"Бостандыкский р-н, Егизбаева — Сатпаева",Алматы29 нояб.,"жил. комплекс Тау Самал (КГ), монолитный дом, 2016 г.п., состояние: евроремонт, потолки 2.8м., санузел совмещенный, телефон: отдельный, интернет ADSL, частично меблирована, Асыл Тау» — жилой комплекс от застройщика BI Group ЖК «Асыл Тау» имеет удобное расположение. Пластиковые окна, неугло…"
"2-комнатная квартира, 55 м², 5/5 этажВсе заметкиУдалить",https://krisha.kz//a/show/663598419,26 000 000〒,"Бостандыкский р-н, Утепова 2 — Жарокова",Алматы29 нояб.,"кирпичный дом, 1976 г.п., состояние: евроремонт, потолки 2.6м., санузел совмещенный, телефон: отдельный, интернет оптика, полностью меблирована, Продам 2 комнатную квартиру в лучшем месте Бостандыкского района. Кирпичный дом типа СовМин с просторными подъездами и высокими потолками. Находит…"
