Заголовок,ссылка,Цена,Адрес,Дата,comment
"2-комнатная квартира, 58 м², 2/5 этажВсе заметкиУдалить",https://krisha.kz//a/show/57974984,25 600 000〒,"Алмалинский р-н, Макатаева 81 — Панфилова",Алматы29 нояб.,"кирпичный дом, 1982 г.п., состояние: хорошее, жил. площадь 35 кв.м., кухня 16 кв.м., санузел совмещенный, телефон: отдельный, интернет ADSL, полностью меблирована, Центр города, рядом всё необходимое, школы, ЦУМ, ГУМ, транспорт во все направления"
"2-комнатная квартира, 54 м², 4/5 этажВсе заметкиУдалить",https://krisha.kz//a/show/663610792,20 900 000〒,"Алмалинский р-н, мкр Тастак-2, Дуйсенова",Алматы29 нояб.,"панельный дом, 1980 г.п., состояние: хорошее, потолки 2.85м., санузел раздельный, частично меблирована, Срочная продажа ！Ленинградский проект ！Отличное расположение！Развитая инфраструктура района！"
"2-комнатная квартира, 53 м², 7/9 этажВсе заметкиУдалить",https://krisha.kz//a/show/660057267,26 500 000〒,"Алмалинский р-н, Досмухамедова — Казыбек би",Алматы29 нояб.,"панельный дом, 1982 г.п., Светлая квартира с изолированными комнатами, сан. узел раздельный. Пластиковые окна, новые межкомнатные двери, новая сан. сантехника и кафель, встроенные шкафы. Тихий двор, хорошая транспортная сетка, развитая инфраструктура"
"2-комнатная квартира, 60 м², 8/16 этажВсе заметкиУдалить",https://krisha.kz//a/show/660120301,28 000 000〒,"Алмалинский р-н, Толе би",Алматы29 нояб.,"жил. комплекс Каусар, монолитный дом, 2005 г.п., состояние: евроремонт, жил. площадь 35 кв.м., кухня 12 кв.м., потолки 2.8м., санузел совмещенный, телефон: отдельный, интернет оптика, полностью меблирована"
"2-комнатная квартира, 57 м², 9/9 этажВсе заметкиУдалить",https://krisha.kz//a/show/662721870,22 500 000〒,"Алмалинский р-н, Проспект Назарбаева — проспект Жибек Жолы",Алматы29 нояб.,"1974 г.п., состояние: требует ремонта, жил. площадь 31 кв.м., кухня 7 кв.м., потолки 2.8м., Продается 2-х комнатная квартира пр-т Назарбаева /пр-т Жибек Жолы. Дом колонно-ригельный, сейсмостойкость 10 баллов, 1974 года постройки. 9эт/9эт; общая -57, 0м2, комнаты раздельные: 19, 1м2, комната 12, 1…"
"2-комнатная квартира, 43 м², 13/13 этажВсе заметкиУдалить",https://krisha.kz//a/show/663610195,17 500 000〒,"Алмалинский р-н, Муратбаева — Макатаева",Алматы29 нояб.,"жил. комплекс 12 месяцев, монолитный дом, 2020 г.п., состояние: свободная планировка, жил. площадь 43 кв.м., санузел совмещенный, телефон: есть возможность подключения, интернет оптика"
"2-комнатная квартира, 95 м², 11/12 этажВсе заметкиУдалить",https://krisha.kz//a/show/21040224,30 000 000〒,"Алмалинский р-н, Толе би — Лихачева",Алматы29 нояб.,"жил. комплекс Жайлы, монолитный дом, 2015 г.п., состояние: хорошее, жил. площадь 46.5 кв.м., кухня 17.1 кв.м., потолки 2.7м., санузел 2 с/у и более, телефон: отдельный, интернет оптика, частично меблирована, Огромная, новая и теплая квартира, с удачной планировкой (есть возможность передел…"
"2-комнатная квартира, 58 м², 5/5 этажВсе заметкиУдалить",https://krisha.kz//a/show/58229487,29 500 000〒,"Алмалинский р-н, Жамбыла 84 — Шевченко",Алматы29 нояб.,"кирпичный дом, 1988 г.п., состояние: евроремонт, санузел раздельный, интернет оптика, полностью меблирована, Продается уютная квартира в центре города. Окна сквозные, смотрят на север и на юг, поэтому хорошо проветривается. При восходе солнце не светит прямо на окна, поэтому летом не жарко, но зим…"
"2-комнатная квартира, 50 м², 1/5 этажВсе заметкиУдалить",https://krisha.kz//a/show/663610006,18 900 000〒,"Алмалинский р-н, мкр Тастак-2, Брусиловского",Алматы29 нояб.,"панельный дом, 1995 г.п., состояние: среднее, жил. площадь 28 кв.м., кухня 10.8 кв.м., потолки 2.5м., санузел раздельный, телефон: отдельный, интернет оптика, пустая, Развитая инфраструктура, в шаговой доступности все рядом 4школы, дет. сады, поликлиника рынок. Имеется 2 кладовки. На кухне газо…"
"2-комнатная квартира, 64 м², 1/18 этажВсе заметкиУдалить",https://krisha.kz//a/show/660928225,29 500 000〒,"Алмалинский р-н, Брусиловского 167 — Шакарима",Алматы29 нояб.,"жил. комплекс Алтын Булак 2, монолитный дом, 2012 г.п., состояние: хорошее, потолки 2.8м., санузел 2 с/у и более, 2-й дом от Брусиловского очень теплый, внизу 2 этажа паркинга, магазин продуктовый все через лифт. охраняемая территория"
"2-комнатная квартира, 54 м², 5/5 этажВсе заметкиУдалить",https://krisha.kz//a/show/663609451,26 500 000〒,"Алмалинский р-н, Мауленова 133 — проспект Абая",Алматы29 нояб.,"кирпичный дом, 1975 г.п., состояние: хорошее, жил. площадь 30 кв.м., кухня 14 кв.м., санузел раздельный, Пластиковые окна, неугловая, улучшенная, комнаты изолированы, встроенная кухня, новая сантехника, счётчики, тихий двор. Обменяю на Астану на 3 комнатную (возможна разумной доплата) или Пр…"
"2-комнатная квартира, 55 м², 4/5 этажВсе заметкиУдалить",https://krisha.kz//a/show/663384860,20 000 000〒,"Алмалинский р-н, проспект Райымбека 167г — Наурызбай Батыра",Алматы29 нояб.,"панельный дом, 1993 г.п., состояние: среднее, жил. площадь 32 кв.м., кухня 9 кв.м., санузел раздельный"
"2-комнатная квартира, 58 м², 18/19 этажВсе заметкиУдалить",https://krisha.kz//a/show/662271743,26 500 000〒,"Алмалинский р-н, Брусиловского 144 — Прокофьева",Алматы29 нояб.,"жил. комплекс Манхеттан (29 квартал), монолитный дом, 2007 г.п., жил. площадь 34 кв.м., кухня 10.4 кв.м., потолки 3м., санузел совмещенный, телефон: отдельный, интернет оптика, полностью меблирована"
"2-комнатная квартира, 43 м², 4/14 этажВсе заметкиУдалить",https://krisha.kz//a/show/662783837,28 000 000〒,"Алмалинский р-н, Манаса 22/2 — Абая",Алматы29 нояб.,"жил. комплекс LEGENDA, монолитный дом, 2021 г.п., состояние: черновая отделка, жил. площадь 27 кв.м., кухня 6 кв.м., потолки 3м., санузел совмещенный, пустая, Продам 2х комнатную квартиру в ЖК «Легенда». Жилье бизнес класса в центре города. Тихий, охраняемый и изолированный двор. Срок сдачи осень…"
"2-комнатная квартира, 55 м², 1/16 этажВсе заметкиУдалить",https://krisha.kz//a/show/661064164,23 000 000〒,"Алмалинский р-н, Толе би 273а — Тлендиева",Алматы29 нояб.,"В залоге, жил. комплекс Жайлы, монолитный дом, 2015 г.п., состояние: хорошее, жил. площадь 40 кв.м., кухня 5 кв.м., потолки 3м., санузел совмещенный, телефон: есть возможность подключения, частично меблирована, Солнечная сторона, окна смотрят во двор, торг незначительный, спальня - 13, 5 кв…"
"2-комнатная квартира, 65 м², 15/17 этажВсе заметкиУдалить",https://krisha.kz//a/show/663466633,30 500 000〒,"Алмалинский р-н, Ауэзова — Толе би",Алматы29 нояб.,"жил. комплекс Assem Plaza, монолитный дом, 2020 г.п., состояние: черновая отделка, жил. площадь 55 кв.м"
"2-комнатная квартира, 41 м², 3/4 этажВсе заметкиУдалить",https://krisha.kz//a/show/662908437,29 000 000〒,"Алмалинский р-н, улица Наурызбай Батыра 126 — Шевченко",Алматы29 нояб.,"кирпичный дом, 1965 г.п., состояние: хорошее, санузел совмещенный, интернет проводной, полностью меблирована, Теплая квартира для проживания. при желании очень легко и быстро сдается, все коммуникации рядом. напротив стадиона Динамо, золотой квадрат. хорошая детская площадка, рядом находятся школы…"
"2-комнатная квартира, 42.5 м², 2/4 этажВсе заметкиУдалить",https://krisha.kz//a/show/53095040,25 990 000〒,"Алмалинский р-н, Наурызбай Батыра 148 — Абая",Алматы29 нояб.,"кирпичный дом, 1965 г.п., состояние: евроремонт, потолки 2.8м., санузел совмещенный, интернет оптика, частично меблирована, Уютная 2-х комнатная квартира с потрясающим расположением: золотой квадрат, центр. Остановка общественного транспорта прямо напротив дома. Рядом с домом разбит сквер…"
"2-комнатная квартира, 42 м², 5/5 этажВсе заметкиУдалить",https://krisha.kz//a/show/662483775,23 200 000〒,"Алмалинский р-н, Чайковского 32 — Маметовой",Алматы29 нояб.,"В залоге, панельный дом, 1973 г.п., состояние: хорошее, жил. площадь 17.2 кв.м., кухня 6 кв.м., потолки 2.7м., санузел совмещенный, интернет проводной, частично меблирована, Продам 2-х комнатную квартиру полностью мебелью, рядом Цон, Цум, автобусы на все направление, Арбат, Магнум ипоте…"
"2-комнатная квартира, 67 м², 2/13 этажВсе заметкиУдалить",https://krisha.kz//a/show/663596247,25 800 000〒,"Алмалинский р-н, мкр Тастак-2, Мкр Тастак-2",Алматы29 нояб.,"монолитный дом, 2016 г.п., состояние: свободная планировка, телефон: есть возможность подключения, интернет проводной, 2-комнатная квартира свободной планировки. Дом полностью монолитный, сейсмостойкость 9 баллов. Дом введен в эксплуатацию, заселен. высота потолков - 3 м, окна большие, высоки…"
"2-комнатная квартира, 54 м², 2/5 этажВсе заметкиУдалить",https://krisha.kz//a/show/663532343,34 500 000〒,"Алмалинский р-н, Жамбыла 84 — Чайковского",Алматы29 нояб.,"кирпичный дом, 1988 г.п., состояние: евроремонт, жил. площадь 32 кв.м., санузел раздельный, телефон: отдельный, интернет ADSL, частично меблирована, Золотой квадрат тихий двор, одна квартира на площадке, окна смотрят на Юг-Север, рядом всё необходимое для комфортного проживания транспорт во вс…"
"2-комнатная квартира, 43 м², 3/5 этажВсе заметкиУдалить",https://krisha.kz//a/show/663616557,19 500 000〒,"Алмалинский р-н, Алмалинский район 178 — Ауезова",Алматы29 нояб.,"панельный дом, 1978 г.п., полностью меблирована, Продаеться квартира 2-х комнатная изолированная, после ремонта, не угловая теплая!"
"2-комнатная квартира, 57 м², 3/9 этажВсе заметкиУдалить",https://krisha.kz//a/show/663615285,20 000 000〒,"Алмалинский р-н, Розыбакиева — Райымбека",Алматы29 нояб.,"монолитный дом, 2015 г.п., состояние: среднее, санузел раздельный, телефон: отдельный, интернет через TV кабель, частично меблирована"
"2-комнатная квартира, 46 м², 5/5 этажВсе заметкиУдалить",https://krisha.kz//a/show/58116615,19 900 000〒,"Алмалинский р-н, Богенбай Батыра 268",Алматы29 нояб.,"кирпичный дом, 1983 г.п., Эксклюзивное предложение! срочно! ТОРГ! ТОРГ! ТОРГ! Отличный вариант! Отличное предложение в востребованном районе! Развитая инфраструктура делает комфортным проживание в этом районе! В шаговой доступности школы, детсады, колледжи, университеты, поликлиника, магази…"
"2-комнатная квартира, 57 м², 3/3 этажВсе заметкиУдалить",https://krisha.kz//a/show/663613373,13 100 000〒,"Алмалинский р-н, Досмухамедова — Гоголя",Алматы29 нояб.,"кирпичный дом, 1958 г.п., состояние: хорошее, жил. площадь 40 кв.м., кухня 9 кв.м., санузел совмещенный, телефон: отдельный, частично меблирована, Удобно под сдачу в аренду"
"2-комнатная квартира, 65 м², 5/5 этажВсе заметкиУдалить",https://krisha.kz//a/show/663613106,18 500 000〒,"Алмалинский р-н, Болотникова 57",Алматы29 нояб.,"В залоге, кирпичный дом, 1987 г.п., состояние: хорошее, Продается залоговая квартира. Сумма залога 10.000.000 тенге, 9 лет, ежемесячный платеж 110.000 тенге"
"2-комнатная квартира, 41.2 м², 5/5 этажВсе заметкиУдалить",https://krisha.kz//a/show/660269737,17 400 000〒,"Алмалинский р-н, Радостовца 39",Алматы29 нояб.,"панельный дом, 1977 г.п., жил. площадь 26.3 кв.м., кухня 5.9 кв.м., Имущество АО «Народный Банк Казахстана» Доступно льготное кредитование по программе ""Halyk Sale"" : для физ. лиц. - ставка вознаграждения – от 8%, сроком до 20 лет К моменту принятия Банком решения о заключении договор…"
"2-комнатная квартира, 46 м², 3/17 этажВсе заметкиУдалить",https://krisha.kz//a/show/663612040,23 900 000〒,"Алмалинский р-н, Егизбаева Косая — Сатпаева",Алматы29 нояб.,"жил. комплекс Асыл Тау, монолитный дом, 2014 г.п., состояние: евроремонт, санузел раздельный, частично меблирована, Пластиковые окна, новая сантехника, счётчики, неугловая, комнаты изолированы, встроенная кухня, тихий двор видеонаблюдение, домофон Продается переделанную двух комнатную квартир…"
"2-комнатная квартира, 41 м², 8/12 этажВсе заметкиУдалить",https://krisha.kz//a/show/663611981,23 300 000〒,"Алмалинский р-н, Сатпаева",Алматы29 нояб.,"жил. комплекс Симфония, монолитный дом, 2015 г.п., состояние: евроремонт, санузел совмещенный, частично меблирована, Пластиковые окна, новая сантехника, счётчики, неугловая, комнаты изолированы, встроенная кухня, тихий двор видеонаблюдение, домофон Территория полностью охраняется 24 часа в сут…"
"2-комнатная квартира, 60 м², 11/13 этажВсе заметкиУдалить",https://krisha.kz//a/show/663611940,23 900 000〒,"Алмалинский р-н, Абая проспект — Розыбакиева",Алматы29 нояб.,"монолитный дом, 1993 г.п., состояние: хорошее, телефон: отдельный, интернет оптика, пустая, Пластиковые окна, новая сантехника, счётчики, неугловая, тихий двор видеонаблюдение, домофон Срочно продается двух комнатная квартира улучшенной планировки в одном из самых востребованных районов гор…"
"2-комнатная квартира, 45 м², 3/4 этажВсе заметкиУдалить",https://krisha.kz//a/show/661411741,20 900 000〒,"Алмалинский р-н, Байзакова — Шевченко",Алматы29 нояб.,"кирпичный дом, 1968 г.п., состояние: евроремонт, санузел совмещенный, телефон: отдельный, интернет ADSL, частично меблирована, Продам двухкомнатную квартиру в одном из лучших !экологически ! чистом ! районе нашего города! Перепланировка узаконена, не в залоге, все документы в порядке! Вокруг дома м…"
"2-комнатная квартира, 46 м², 3/14 этажВсе заметкиУдалить",https://krisha.kz//a/show/663611407,30 500 000〒,"Алмалинский р-н, Манаса",Алматы29 нояб.,"жил. комплекс LEGENDA, монолитный дом, 2015 г.п., состояние: евроремонт, санузел совмещенный, пустая, Видеодомофон, видеонаблюдение, домофон, консьерж ВНИМАНИЕ! СРОЧНО! Продается 2х комнатная квартира в ЖК «Легенда». Жилье бизнес класса в центре города. В особенном квартале LEGENDA предус…"
"2-комнатная квартира, 43 м², 4/14 этажВсе заметкиУдалить",https://krisha.kz//a/show/663611401,27 400 000〒,"Алмалинский р-н, Манаса",Алматы29 нояб.,"жил. комплекс LEGENDA, монолитный дом, 2015 г.п., состояние: черновая отделка, жил. площадь 27 кв.м., кухня 6 кв.м., санузел совмещенный, пустая, Видеодомофон, видеонаблюдение, домофон, консьерж ВНИМАНИЕ! СРОЧНО! Продается 2х комнатная квартира в ЖК «Легенда». Жилье бизнес класса в центре гор…"
"2-комнатная квартира, 45.3 м², 3/9 этажВсе заметкиУдалить",https://krisha.kz//a/show/662050385,27 000 000〒,"Алмалинский р-н, Маметовой",Алматы29 нояб.,"панельный дом, 1986 г.п., состояние: евроремонт, потолки 2.7м., санузел совмещенный, телефон: отдельный, интернет ADSL, полностью меблирована, Отличный вариант! Звоните!"
"2-комнатная квартира, 63 м², 8/18 этажВсе заметкиУдалить",https://krisha.kz//a/show/663446199,49 000 000〒,"Алмалинский р-н, Манаса — Абая",Алматы29 нояб.,"жил. комплекс LEGENDA, монолитный дом, 2018 г.п., состояние: евроремонт, санузел 2 с/у и более, полностью меблирована"
"2-комнатная квартира, 53 м², 2/5 этажВсе заметкиУдалить",https://krisha.kz//a/show/663610730,29 800 000〒,"Алмалинский р-н, Айманова — Курмангазы",Алматы29 нояб.,"кирпичный дом, 1983 г.п., состояние: евроремонт, санузел раздельный, телефон: отдельный, интернет оптика, полностью меблирована, Квартира блеск, приехали, посмотрели, влюбились, купили, живите и наслаждайтесь)"
"2-комнатная квартира, 50 м², 3/4 этажВсе заметкиУдалить",https://krisha.kz//a/show/662512052,25 000 000〒,"Алмалинский р-н, Желтоксан 144 — Жамбыла",Алматы28 нояб.,"кирпичный дом, 1960 г.п., состояние: требует ремонта, жил. площадь 30 кв.м., кухня 10 кв.м., санузел совмещенный, телефон: отдельный, интернет через TV кабель, Золотой квадрат тихий двор рядом всё необходимое для комфортного проживания транспорт во все направления. Торга Нет"
"2-комнатная квартира, 45 м², 4/5 этажВсе заметкиУдалить",https://krisha.kz//a/show/663586841,17 800 000〒,"Алмалинский р-н, Шарипова Ади (Мечникова) — Макатаева (Пастера)",Алматы28 нояб.,"панельный дом, 1974 г.п., состояние: хорошее, жил. площадь 28 кв.м., кухня 6 кв.м., санузел совмещенный, Срочно! торг минимальный. Средний этаж, Не угловая, самая просторная планировка Вагончик, комнаты расположены в две стороны дома, что обеспечивает отличную проветриваемость помещения. Ест…"
