Заголовок,ссылка,Цена,Адрес,Дата,comment
"4-комнатная квартира, 88 м², 3/3 этажВсе заметкиУдалить",https://krisha.kz//a/show/663019133,49 000 000〒,"Алмалинский р-н, Абая 53/51 — Чайковского",Алматы29 нояб.,"кирпичный дом, 1960 г.п., состояние: требует ремонта, потолки 3.5м., санузел раздельный, телефон: отдельный, интернет через TV кабель, пустая, Ведомственный дом ЦК. Огорожен. Парковка"
"4-комнатная квартира, 114 м², 1/3 этажВсе заметкиУдалить",https://krisha.kz//a/show/660932094,65 000 000〒,"Алмалинский р-н, Абая 51/53 — Чайковского",Алматы29 нояб.,"кирпичный дом, 1960 г.п., состояние: среднее, санузел раздельный, телефон: отдельный, интернет через TV кабель, частично меблирована, Дом ЦК"
"4-комнатная квартира, 137 м², 4/12 этажВсе заметкиУдалить",https://krisha.kz//a/show/662600363,65 000 000〒,"Алмалинский р-н, Мауленова 111 — Шевченко",Алматы29 нояб.,"жил. комплекс Жастар Атамекен, монолитный дом, 2007 г.п., состояние: хорошее, жил. площадь 90 кв.м., санузел 2 с/у и более, телефон: отдельный, интернет через TV кабель, частично меблирована"
"4-комнатная квартира, 120 м², 10/13 этажВсе заметкиУдалить",https://krisha.kz//a/show/53516363,43 400 000〒,"Алмалинский р-н, Макатаева 131 — Муратбаева",Алматы29 нояб.,"жил. комплекс Atlant, монолитный дом, 2019 г.п., потолки 2.7м., санузел 2 с/у и более, Жилой комплекс ATLANT — превосходные перспективы жизни для молодых семей. Доступные цены на жилье, активное развитие инфраструктуры Жилой комплекс ATLANT — один из самых крупных проектов компании — располо…"
"4-комнатная квартира, 97 м², 8/9 этажВсе заметкиУдалить",https://krisha.kz//a/show/663610024,40 500 000〒,"Алмалинский р-н, улица Аносова 133 — Шакарима",Алматы29 нояб.,"панельный дом, 1991 г.п., состояние: евроремонт, потолки 2.9м., санузел раздельный, частично меблирована, СРОЧНО. Чистая ютная тёплая светлая квартира. Встроенный большой гардероб. Комнаты большие. Окна север-юг. Новый лифт 2020 Детская спортивная площадка новые 2020 года. Тихий двор. Из меб…"
"4-комнатная квартира, 152 м², 5/12 этажВсе заметкиУдалить",https://krisha.kz//a/show/662786728,63 000 000〒,"Алмалинский р-н, Варламова 33а",Алматы29 нояб.,"В залоге, жил. комплекс Жагалау - 46 квартал, монолитный дом, 2012 г.п., состояние: хорошее, жил. площадь 82 кв.м., кухня 22 кв.м., потолки 3м., санузел 2 с/у и более, Пластиковые окна, неугловая, улучшенная, комнаты изолированы, встроенная кухня, новая сантехника, кладовка, счётчики, тихий д…"
"4-комнатная квартира, 152 м², 5/12 этажВсе заметкиУдалить",https://krisha.kz//a/show/661799186,63 000 000〒,"Алмалинский р-н, Варламова",Алматы29 нояб.,"жил. комплекс Жагалау - 46 квартал, монолитный дом, 2012 г.п., состояние: евроремонт, жил. площадь 87.2 кв.м., кухня 21 кв.м., потолки 3м., санузел 2 с/у и более, телефон: отдельный, интернет через TV кабель, частично меблирована, Пластиковые окна, неугловая, улучшенная, комнаты изолированы, встрое…"
"4-комнатная квартира, 85 м², 9/9 этажВсе заметкиУдалить",https://krisha.kz//a/show/663519681,37 000 000〒,"Алмалинский р-н, Айманова 192 — Толе би",Алматы29 нояб.,"панельный дом, 1986 г.п., состояние: хорошее, жил. площадь 52 кв.м., кухня 9 кв.м., потолки 2.85м., санузел раздельный, телефон: отдельный, интернет ADSL, частично меблирована, Красивый ухоженный двор, своё место для авто, не угловая, в шаговой доступности многопрофильная гимназия 79, парк ганди…"
"4-комнатная квартира, 84 м², 1/5 этажВсе заметкиУдалить",https://krisha.kz//a/show/54924521,36 000 000〒,"Алмалинский р-н, Курмангазы 177 — Гагарина",Алматы28 нояб.,"панельный дом, 1994 г.п., состояние: хорошее, жил. площадь 53 кв.м., кухня 11 кв.м., потолки 2.8м., санузел 2 с/у и более, телефон: отдельный, интернет оптика, частично меблирована, Пластиковые окна, не угловая, улучшенная, комнаты изолированы, встроенная кухня, кладовка, счётчики, тихий дво…"
"4-комнатная квартира, 75 м², 3/5 этажВсе заметкиУдалить",https://krisha.kz//a/show/663433967,30 000 000〒,"Алмалинский р-н, Назарбаева — Маметовой",Алматы29 нояб.,"панельный дом, 1975 г.п., жил. площадь 50 кв.м., кухня 8.5 кв.м., частично меблирована, Здесь Удобно Жить • Отличная Планировка — все комнаты изолированные, каждая со своим отдельным входом. Окна выходят на две стороны — юг и север. Есть балкон. Теплая — располагается посередине. Третий этаж! • В…"
"4-комнатная квартира, 160 м², 3/7 этажВсе заметкиУдалить",https://krisha.kz//a/show/662350568,105 000 000〒,"Алмалинский р-н, Панфилова 113/56 — Гоголя",Алматы28 нояб.,"жил. комплекс КУАТ на Панфилова - Гоголя, кирпичный дом, 2004 г.п., состояние: евроремонт, санузел 2 с/у и более, телефон: отдельный, частично меблирована, Молодая активная семья, которая ищет тёплую, уютную квартиру в центре города, если это Вы? То это ваш вариант! Шаговая доступность до школ…"
"4-комнатная квартира, 115 м², 4/18 этажВсе заметкиУдалить",https://krisha.kz//a/show/23950122,55 000 000〒,"Алмалинский р-н, Брусиловского 167 — Шакарима",Алматы28 нояб.,"жил. комплекс Алтын Булак 2, монолитный дом, 2012 г.п., состояние: евроремонт, жил. площадь 82 кв.м., кухня 8 кв.м., потолки 3м., санузел 2 с/у и более, телефон: отдельный, интернет проводной, полностью меблирована, Продам 4х комнатную квартиру, которая была куплена в черновом варианте в январ…"
"4-комнатная квартира, 230 м², 5/6 этажВсе заметкиУдалить",https://krisha.kz//a/show/661397786,140 000 000〒,"Алмалинский р-н, Курмангазы 141 — Шевченко",Алматы28 нояб.,"жил. комплекс Изумрудный город, монолитный дом, 2006 г.п., состояние: евроремонт, санузел 2 с/у и более, интернет проводной, частично меблирована"
"4-комнатная квартира, 78 м², 1/9 этажВсе заметкиУдалить",https://krisha.kz//a/show/663008616,24 500 000〒,"Алмалинский р-н, Толе Би",Алматы28 нояб.,"монолитный дом, 1991 г.п., состояние: хорошее, жил. площадь 45 кв.м., кухня 8 кв.м., потолки 2.8м., санузел 2 с/у и более, телефон: есть возможность подключения, интернет ADSL, частично меблирована, Агентство недвижимости ""Qubiq"" предлагает Вам эксклюзивный вариант! Отличный вариант дл…"
"4-комнатная квартира, 79 м², 2/5 этажВсе заметкиУдалить",https://krisha.kz//a/show/663542413,37 000 000〒,"Алмалинский р-н, Муратбаева — Айтеке би",Алматы28 нояб.,"панельный дом, 1975 г.п., состояние: евроремонт, потолки 2м., санузел раздельный, (№ BDQ-8 - 17954) Супер выгодное предложение для большой и дружной семьи. Квартира оснащена системой умного дома smart home mi. Умный свет, датчики движения, датчики утечки воды, видео наблюдение. Робот пылесос. Ряд…"
"4-комнатная квартира, 79 м², 1/9 этажВсе заметкиУдалить",https://krisha.kz//a/show/663590368,24 990 000〒,"Алмалинский р-н, Толе би — Тлендиева",Алматы28 нояб.,"монолитный дом, 1991 г.п., состояние: хорошее, жил. площадь 51.7 кв.м., кухня 8 кв.м., потолки 2.8м., санузел 2 с/у и более, полностью меблирована, (№ BDQ-8 - 9536) Агентство недвижимости ""Qubiq"" предлагает Вам эксклюзивный вариант! 4 изолированные комнаты (17.7) (9.1) (12.2) (12…"
"4-комнатная квартира, 90 м², 3/4 этажВсе заметкиУдалить",https://krisha.kz//a/show/662463497,51 777 777〒,"Алмалинский р-н, Наурызбай батыра 126 — Шевченко",Алматы29 нояб.,"В залоге, кирпичный дом, 1960 г.п., состояние: евроремонт, жил. площадь 75 кв.м., потолки 2.5м., санузел 2 с/у и более, телефон: есть возможность подключения, интернет ADSL, частично меблирована, Квартира после ремонта: дорогой паркет Coswick, окна немецкие Rehaw, проводка и предохранители Schnei…"
"4-комнатная квартира, 170 м², 9/9 этажВсе заметкиУдалить",https://krisha.kz//a/show/57377846,60 000 000〒,"Алмалинский р-н, Шевченко — Айманова",Алматы29 нояб.,"кирпичный дом, 1995 г.п., состояние: хорошее, жил. площадь 116 кв.м., кухня 31 кв.м., потолки 2.8м., санузел совмещенный, телефон: отдельный, интернет оптика, частично меблирована, Продается квартира в связи с переездом с хорошей планировкой с ремонтом, два сан. узла, 2 -е гардеробные с хоро…"
"4-комнатная квартира, 90 м², 3/3 этажВсе заметкиУдалить",https://krisha.kz//a/show/48807152,49 000 000〒,"Алмалинский р-н, Абая 51/53 — Желтоксан",Алматы29 нояб.,"кирпичный дом, 1960 г.п., состояние: требует ремонта, потолки 3.5м., санузел раздельный, телефон: отдельный, интернет через TV кабель, пустая, Дом ЦК огорожен. парковка. шлагбаум"
"4-комнатная квартира, 90 м², 2/5 этажВсе заметкиУдалить",https://krisha.kz//a/show/661323041,49 000 000〒,"Алмалинский р-н, Исаева — Жамбыла",Алматы29 нояб.,"кирпичный дом, 1992 г.п., состояние: евроремонт, жил. площадь 60 кв.м., кухня 11 кв.м., потолки 2.8м., санузел раздельный, телефон: отдельный, интернет оптика, частично меблирована, Продам 4 комнатную квартиру в центре города. Дом кирпичный и савминовский. Толстые стены. Летом прохладно, зимой те…"
"4-комнатная квартира, 118 м², 12/15 этажВсе заметкиУдалить",https://krisha.kz//a/show/663614170,110 000 000〒,"Алмалинский р-н, Манаса",Алматы29 нояб.,"жил. комплекс LEGENDA, монолитный дом, 2019 г.п., состояние: евроремонт, санузел 2 с/у и более, полностью меблирована, Шикарная квартира бери и живи, все для вас"
"4-комнатная квартира, 130 м², 12/16 этажВсе заметкиУдалить",https://krisha.kz//a/show/58585862,75 000 000〒,"Алмалинский р-н, Наурызбай батыра 99/1 — Шевченко",Алматы29 нояб.,"жил. комплекс Шанырак, монолитный дом, 2014 г.п., состояние: евроремонт, жил. площадь 85 кв.м., кухня 18 кв.м., потолки 3м., санузел 2 с/у и более, телефон: отдельный, интернет оптика, полностью меблирована, Отличная, просторная квартира для дружной семьи. Все есть и все работает, полностью меблиро…"
"4-комнатная квартира, 66 м², 2/4 этажВсе заметкиУдалить",https://krisha.kz//a/show/56007955,35 000 000〒,"Алмалинский р-н, улица Гоголя 100 — Гоголя Мауленова",Алматы29 нояб.,"В залоге, кирпичный дом, 1962 г.п., состояние: хорошее, жил. площадь 47 кв.м., кухня 7.6 кв.м., потолки 2.55м., санузел раздельный, телефон: отдельный, интернет проводной, частично меблирована"
"4-комнатная квартира, 110 м², 1/5 этажВсе заметкиУдалить",https://krisha.kz//a/show/663511044,33 500 000〒,"Алмалинский р-н, Туркебаева 96",Алматы29 нояб.,"кирпичный дом, 1990 г.п., состояние: евроремонт, жил. площадь 76 кв.м., кухня 15 кв.м., санузел раздельный, телефон: отдельный, интернет ADSL, полностью меблирована, Срочная продажа!"
"4-комнатная квартира, 110 м², 12/13 этажВсе заметкиУдалить",https://krisha.kz//a/show/55729512,42 000 000〒,"Алмалинский р-н, Казыбек би 139 — Шагабутдинова",Алматы29 нояб.,"жил. комплекс Бастау, монолитный дом, 2016 г.п., состояние: хорошее, санузел 2 с/у и более, телефон: отдельный, интернет ADSL, частично меблирована, ЖК ""Бастау"" расположен в центре Алмалинского р-на, с богатой инфраструктурой и удобным транспортным выходом. Варианты обмена рассматриваются"
"4-комнатная квартира, 170 м², 7/14 этажВсе заметкиУдалить",https://krisha.kz//a/show/662740625,75 000 000〒,"Алмалинский р-н, Масанчи 98а",Алматы29 нояб.,"жил. комплекс КУАТ на Масанчи - Абая, монолитный дом, 2003 г.п., состояние: евроремонт, потолки 3м., санузел 2 с/у и более, телефон: отдельный, интернет ADSL, полностью меблирована, Отличный вариант! Торг!"
"4-комнатная квартира, 139 м², 12/20 этажВсе заметкиУдалить",https://krisha.kz//a/show/663611513,52 000 000〒,"Алмалинский р-н, Брусиловского — Шакарима",Алматы29 нояб.,"жил. комплекс Манхеттан (29 квартал), монолитный дом, 2007 г.п., состояние: евроремонт, санузел 2 с/у и более, частично меблирована, Пластиковые окна, улучшенная, новая сантехника, счётчики, кондиционер, неугловая, комнаты изолированы, встроенная кухня, кладовка, тихий двор видеонаблюдение, домофон"
"4-комнатная квартира, 78 м², 3/5 этажВсе заметкиУдалить",https://krisha.kz//a/show/663611063,30 500 000〒,"Алмалинский р-н, мкр Тастак-2, Брусиловского — Дуйсенова",Алматы29 нояб.,"панельный дом, 1981 г.п., состояние: хорошее, жил. площадь 51 кв.м., кухня 11 кв.м., потолки 2.85м., санузел раздельный, интернет проводной, полностью меблирована, Продается просторная, светлая квартира хорошем состоянии, полностью меблированная, с бытовой техникой. Замечательная инфраструктура…"
"4-комнатная квартира, 85 м², 4/5 этажВсе заметкиУдалить",https://krisha.kz//a/show/663611273,26 200 000〒,"Алмалинский р-н, мкр Тастак-2, Мкр Тастак-2",Алматы29 нояб.,"кирпичный дом, 1989 г.п., состояние: хорошее, потолки 2.75м., санузел раздельный, частично меблирована, - Кирпичный дом - лучше сохраняет тепло, а в знойную жару встретит вас приятной прохладой. Кирпич так же имеет лучшую шумоизоляцию, вас не будут беспокоить ненужные шумы. Выше срок службы…"
"4-комнатная квартира, 76 м², 3/12 этажВсе заметкиУдалить",https://krisha.kz//a/show/25771032,33 000 000〒,"Алмалинский р-н, Розыбакиева 57 — Толе би",Алматы29 нояб.,"панельный дом, 1988 г.п., состояние: хорошее, потолки 2.7м., санузел раздельный, телефон: отдельный, интернет ADSL, полностью меблирована, Продам квартиру с отличным ремонтом. Светлая и уютная"
"4-комнатная квартира, 91 м², 8/9 этажВсе заметкиУдалить",https://krisha.kz//a/show/663384848,40 500 000〒,"Алмалинский р-н, улица Аносова — Шакарима",Алматы29 нояб.,"панельный дом, 1991 г.п., состояние: евроремонт, потолки 2.9м., санузел раздельный, интернет проводной, частично меблирована, СРОЧНО. Чистая ютная тёплая светлая квартира. Встроенный большой гардероб. Комнаты большие. Окна север-юг. Новый лифт 2020 Детская спортивная площадка новые 2020 года. Т…"
"4-комнатная квартира, 73 м², 4/4 этажВсе заметкиУдалить",https://krisha.kz//a/show/661820275,28 000 000〒,"Алмалинский р-н, Мирзаяна 116 — Айтеке би",Алматы29 нояб.,"панельный дом, 1973 г.п., состояние: евроремонт, санузел совмещенный, телефон: отдельный, частично меблирована, В связи с переездом продаётся 4/х комнатная квартира с отличной локацией, транспортной доступностью. Светлая, тёплая квартира, ремонт в 2018 году, частично мебелирована. Кухня-встроен…"
"4-комнатная квартира, 139 м², 7/20 этажВсе заметкиУдалить",https://krisha.kz//a/show/663611381,49 500 000〒,"Алмалинский р-н, Брусиловского — Шакарима",Алматы29 нояб.,"жил. комплекс Манхеттан (29 квартал), монолитный дом, 2007 г.п., состояние: евроремонт, санузел 2 с/у и более, частично меблирована, Пластиковые окна, улучшенная, новая сантехника, счётчики, кондиционер, неугловая, комнаты изолированы, встроенная кухня, кладовка, тихий двор видеонаблюдение, домофон"
"4-комнатная квартира, 130 м², 6/7 этажВсе заметкиУдалить",https://krisha.kz//a/show/662081049,68 000 000〒,"Алмалинский р-н, Курмангазы 141",Алматы29 нояб.,"жил. комплекс Изумрудный город, кирпичный дом, 2003 г.п., состояние: евроремонт, жил. площадь 65 кв.м., кухня 25 кв.м., потолки 3м., частично меблирована, Лифт. Продается отличная квартира в самом центре города! Светлая, уютная, теплая, с прекрасным панорамным видом из окна! Нешумный двор, хороши…"
"4-комнатная квартира, 104 м², 5/7 этажВсе заметкиУдалить",https://krisha.kz//a/show/663538026,53 000 000〒,"Алмалинский р-н, Гоголя",Алматы28 нояб.,"кирпичный дом, 1974 г.п., состояние: хорошее, жил. площадь 60.5 кв.м., кухня 13.7 кв.м., потолки 2.7м., (№ BDQ-5 - 18622) - СРОЧНАЯ ПРОДАЖА - 4х комнатная квартира в золотом квадрате - 3 изолированные комнаты - Большая гостиная - Просторная кухня 13, 7 квадратов + балкон - 2 сан. узла - Больш…"
"4-комнатная квартира, 90 м², 4/5 этажВсе заметкиУдалить",https://krisha.kz//a/show/662683103,47 000 000〒,"Алмалинский р-н, Макатаева 142 — проспект Сакена Сейфуллина",Алматы28 нояб.,"кирпичный дом, 1993 г.п., состояние: евроремонт, жил. площадь 60.3 кв.м., кухня 12 кв.м., санузел раздельный, телефон: отдельный, интернет ADSL, полностью меблирована, Светлая, просторная квартира с качественным, добротным ремонтом. Весь пакет документов!"
